Description,SKSCodes_range,SKSCodes
Sygdomme i mellemøre og processus mastoideus [DH65-DH75],DH65-DH75,"DH65, DH650, DH650A, DH651, DH651C, DH651D, DH652, DH653, DH654, DH654C, DH659, DH66, DH660, DH660A, DH661, DH662, DH663, DH664, DH669, DH67, DH670, DH671, DH678, DH68, DH680, DH681, DH69, DH690, DH698, DH699, DH70, DH700, DH701, DH702, DH708, DH709, DH71, DH719, DH72, DH720, DH721, DH721A, DH722, DH728, DH728A, DH728B, DH729, DH73, DH730, DH730A, DH731, DH738, DH738A, DH739, DH74, DH740, DH741, DH742, DH743, DH743A, DH743B, DH744, DH748, DH749, DH75, DH750, DH758"
Sygdomme i indre øre [DH80-DH83],DH80-DH83,"DH80, DH800, DH801, DH802, DH808, DH809, DH81, DH810, DH810A, DH811, DH812, DH813, DH813A, DH813B, DH813C, DH813D, DH814, DH814A, DH818, DH819, DH82, DH829, DH83, DH830, DH831, DH832, DH832A, DH832B, DH833, DH833A, DH838, DH839"
Andre sygdomme i øre [DH90-DH95],DH90-DH95,"DH90, DH900, DH901, DH902, DH903, DH904, DH905, DH905A, DH905B, DH905C, DH905D, DH905E, DH906, DH907, DH908, DH91, DH910, DH911, DH912, DH912A, DH913, DH918, DH918A, DH918A1, DH918A2, DH918A3, DH918A4, DH918A5, DH919, DH919A, DH919B, DH92, DH920, DH921, DH922, DH93, DH930, DH930A, DH930B, DH930C, DH931, DH932, DH932A, DH932B, DH932C, DH933, DH933A, DH933B, DH938, DH938A, DH939, DH94, DH940, DH948, DH948A, DH95, DH950, DH951, DH951A, DH951B, DH951C, DH958, DH959"
Gigtfeber [DI00-DI02],DI00-DI02,"DI00, DI009, DI009A, DI009B, DI01, DI010, DI011, DI011A, DI012, DI018, DI018A, DI019, DI02, DI020, DI020A, DI029"
Kroniske reumatiske hjertesygdomme [DI05-DI09],DI05-DI09,"DI05, DI050, DI051, DI052, DI058, DI059, DI06, DI060, DI061, DI062, DI068, DI069, DI07, DI070, DI071, DI072, DI078, DI079, DI08, DI080, DI080A, DI081, DI081A, DI082, DI082A, DI083, DI083A, DI088, DI089, DI09, DI090, DI091, DI091A, DI091B, DI092, DI092A, DI092B, DI092C, DI098, DI098A, DI098B, DI098C, DI098E, DI099, DI099A"
Blodtryksforhøjelse [DI10-DI15],DI10-DI15,"DI10, DI109, DI11, DI110, DI119, DI119A, DI12, DI120, DI129, DI129A, DI13, DI130, DI131, DI132, DI139, DI15, DI150, DI151, DI152, DI158, DI159"
Iskæmiske hjertesygdomme [DI20-DI25],DI20-DI25,"DI20, DI200, DI200B, DI200C, DI201, DI208, DI208D, DI208E, DI208E1, DI208E2, DI209, DI21, DI210, DI210A, DI210B, DI211, DI211A, DI211B, DI213, DI213A, DI213B, DI213C, DI214, DI219, DI219A, DI23, DI230, DI231, DI232, DI233, DI234, DI235, DI236, DI236A, DI236B, DI238, DI238A, DI24, DI240, DI240A, DI241, DI248, DI248A, DI249, DI25, DI251, DI252, DI252A, DI252B, DI252C, DI253, DI254, DI254A, DI254B, DI255, DI256, DI258, DI259"
Pulmonal hjertesygdom og sygdomme i lungekredsløbet [DI26-DI28],DI26-DI28,"DI26, DI260, DI260A, DI269, DI269A, DI27, DI270, DI271, DI272, DI278, DI278A, DI279, DI279A, DI28, DI280, DI281, DI288, DI288A, DI288B, DI289"
Andre former for hjertesygdom [DI30-DI52],DI30-DI52,"DI30, DI300, DI301, DI301A, DI301B, DI301C, DI301D, DI301E, DI308, DI309, DI31, DI310, DI310B, DI310C, DI311, DI311A, DI312, DI313, DI313A, DI318, DI318A, DI318B, DI319, DI319A, DI32, DI320, DI321, DI328, DI33, DI330, DI339, DI34, DI340, DI341, DI342, DI348, DI348A, DI349, DI35, DI350, DI351, DI352, DI358, DI358A, DI359, DI36, DI360, DI361, DI362, DI368, DI368A, DI369, DI37, DI370, DI371, DI372, DI378, DI379, DI38, DI389, DI39, DI390, DI391, DI392, DI393, DI394, DI398, DI40, DI400, DI401, DI408, DI408A, DI409, DI41, DI410, DI411, DI412, DI418, DI42, DI420, DI421, DI421A, DI422, DI423, DI423A, DI423B, DI424, DI424A, DI425, DI426, DI427, DI428, DI428A, DI428B, DI429, DI43, DI430, DI431, DI432, DI438, DI44, DI440, DI441, DI441B, DI441C, DI441D, DI441E, DI442, DI442A, DI443, DI443A, DI444, DI445, DI446, DI446A, DI446B, DI447, DI45, DI450, DI451, DI451A, DI452, DI453, DI454, DI455, DI455A, DI455B, DI455C, DI455G, DI455H, DI455K, DI455L, DI456, DI456A, DI456AA, DI456B, DI456C, DI456D, DI456DA, DI456DB, DI456E, DI458, DI458M, DI458N, DI459, DI459A, DI46, DI460, DI461, DI469, DI47, DI470, DI470A, DI470B, DI470C, DI470D, DI470H, DI470HA, DI470HB, DI471, DI471E, DI471EA, DI471EB, DI471F, DI471FA, DI471G, DI471H, DI471J, DI471L, DI471LA, DI471M, DI471N, DI471P, DI471PA, DI471PB, DI471R, DI471RA, DI471RB, DI471RC, DI471X, DI472, DI472A, DI472B, DI472D, DI472E, DI472EA, DI472EB, DI472F, DI472FA, DI472H, DI472L, DI472LA, DI472LB, DI472LC, DI472M, DI472N, DI472NA, DI478, DI478A, DI479, DI48, DI480, DI481, DI482, DI483, DI484, DI489, DI49, DI490, DI490A, DI490B, DI490BA, DI491, DI491A, DI491B, DI491C, DI491D, DI491E, DI492, DI493, DI493A, DI493B, DI493C, DI494, DI494A, DI495, DI495B, DI498, DI499, DI499A, DI50, DI500, DI500A, DI501, DI501A, DI501B, DI501C, DI501D, DI509, DI51, DI510, DI510A, DI510B, DI511, DI511A, DI512, DI513, DI513A, DI513B, DI513C, DI514, DI514A, DI514B, DI515, DI515A, DI515B, DI516, DI517, DI517A, DI517B, DI517C, DI518, DI518A, DI518B, DI519, DI52, DI520, DI521, DI521C, DI528"
Karsygdomme i hjerne [DI60-DI69],DI60-DI69,"DI60, DI600, DI601, DI602, DI603, DI604, DI605, DI606, DI606A, DI606B, DI606C, DI607, DI607A, DI608, DI609, DI609A, DI61, DI610, DI610A, DI611, DI611A, DI611B, DI612, DI613, DI614, DI615, DI616, DI618, DI619, DI62, DI620, DI621, DI629, DI63, DI630, DI631, DI632, DI633, DI634, DI635, DI636, DI638, DI639, DI64, DI649, DI65, DI650, DI650A, DI650B, DI651, DI651A, DI651B, DI652, DI652A, DI652B, DI653, DI653A, DI653B, DI653C, DI653D, DI658, DI659, DI66, DI660, DI660A, DI660B, DI661, DI661A, DI661B, DI662, DI662A, DI662B, DI663, DI663A, DI663B, DI664, DI664A, DI664B, DI664C, DI664D, DI668, DI668A, DI669, DI67, DI670, DI671, DI671A, DI672, DI672A, DI673, DI673A, DI674, DI675, DI676, DI676A, DI677, DI677A, DI678, DI678A, DI678B, DI679, DI68, DI680, DI681, DI682, DI688, DI69, DI690, DI691, DI692, DI693, DI694, DI698"
"Sygdomme i arterier, arterioler og kapillærer [DI70-DI79]",DI70-DI79,"DI70, DI700, DI701, DI702, DI702A, DI702B, DI708, DI708A, DI709, DI71, DI710, DI710A, DI710B, DI711, DI712, DI713, DI714, DI715, DI716, DI718, DI719, DI719A, DI719B, DI72, DI720, DI721, DI722, DI723, DI724, DI725, DI726, DI728, DI729, DI73, DI730, DI731, DI738, DI738A, DI738B, DI738C, DI738D, DI738E, DI739, DI739A, DI739B, DI739C, DI74, DI740, DI740A, DI740B, DI740C, DI740D, DI741, DI741A, DI741B, DI742, DI742A, DI742B, DI743, DI743A, DI743B, DI744, DI744A, DI744B, DI744C, DI745, DI745A, DI745B, DI748, DI749, DI77, DI770, DI770A, DI770B, DI771, DI772, DI772A, DI772B, DI773, DI774, DI775, DI776, DI776A, DI778, DI778A, DI779, DI78, DI780, DI781, DI781A, DI781B, DI781D, DI788, DI788A, DI788B, DI788C, DI788D, DI789, DI79, DI790, DI791, DI792, DI798"
Sygdomme i vener og lymfesystem IKA [DI80-DI89],DI80-DI89,"DI80, DI800, DI800A, DI800B, DI801, DI801A, DI801B, DI802, DI802A, DI802B, DI803, DI803A, DI803B, DI803C, DI803D, DI803E, DI803F, DI808, DI808A, DI808B, DI808C, DI808D, DI809, DI81, DI819, DI82, DI820, DI821, DI822, DI822A, DI822B, DI823, DI823A, DI823B, DI828, DI829, DI829A, DI829B, DI83, DI830, DI830A, DI830B, DI831, DI831A, DI832, DI839, DI839A, DI839B, DI85, DI850, DI859, DI86, DI860, DI861, DI862, DI863, DI864, DI864A, DI868, DI868A, DI87, DI870, DI871, DI871A, DI871B, DI871C, DI872, DI872A, DI878, DI879, DI88, DI880, DI880A, DI880B, DI881, DI881A, DI888, DI889, DI89, DI890, DI890A, DI890B, DI890C, DI891, DI891A, DI891B, DI891C, DI898, DI898A, DI898B, DI898C, DI899"
Andre og ikke specificerede kredsløbssygdomme [DI95-DI99],DI95-DI99,"DI95, DI950, DI951, DI952, DI958, DI958A, DI959, DI97, DI970, DI971, DI971A, DI972, DI978, DI979, DI98, DI980, DI981, DI982, DI988, DI99, DI999"
Akutte infektioner i øvre luftveje [DJ00-DJ06],DJ00-DJ06,"DJ00, DJ009, DJ01, DJ010, DJ011, DJ012, DJ013, DJ014, DJ018, DJ019, DJ02, DJ020, DJ020A, DJ028, DJ029, DJ029A, DJ029B, DJ029C, DJ03, DJ030, DJ038, DJ039, DJ039A, DJ039B, DJ039C, DJ039D, DJ039E, DJ039F, DJ04, DJ040, DJ040A, DJ040B, DJ040C, DJ040D, DJ041, DJ042, DJ05, DJ050, DJ051, DJ06, DJ060, DJ068, DJ069"
Influenza og lungebetændelse [DJ09-DJ18],DJ09-DJ18,"DJ09, DJ091, DJ091A, DJ091B, DJ10, DJ100, DJ101, DJ101A, DJ101B, DJ101C, DJ108, DJ108A, DJ11, DJ110, DJ111, DJ111A, DJ111B, DJ111C, DJ118, DJ118B, DJ118D, DJ12, DJ120, DJ121, DJ122, DJ123, DJ128, DJ128A, DJ129, DJ13, DJ139, DJ139A, DJ139B, DJ14, DJ149, DJ149A, DJ149B, DJ15, DJ150, DJ151, DJ152, DJ153, DJ154, DJ155, DJ156, DJ156A, DJ157, DJ158, DJ159, DJ16, DJ160, DJ168, DJ17, DJ170, DJ171, DJ172, DJ173, DJ178, DJ18, DJ180, DJ181, DJ182, DJ188, DJ189"
Andre akutte infektioner i nedre luftveje [DJ20-DJ22],DJ20-DJ22,"DJ20, DJ200, DJ200A, DJ201, DJ201A, DJ202, DJ202A, DJ203, DJ203A, DJ204, DJ204A, DJ205, DJ205A, DJ206, DJ206A, DJ207, DJ207A, DJ208, DJ208A, DJ209, DJ209A, DJ21, DJ210, DJ211, DJ218, DJ219, DJ22, DJ229"
Andre sygdomme i øvre luftveje [DJ30-DJ39],DJ30-DJ39,"DJ30, DJ300, DJ300B, DJ301, DJ301A, DJ301B, DJ301C, DJ302, DJ303, DJ303A, DJ304, DJ31, DJ310, DJ311, DJ312, DJ32, DJ320, DJ321, DJ322, DJ323, DJ324, DJ328, DJ329, DJ33, DJ330, DJ331, DJ331A, DJ338, DJ338A, DJ338B, DJ338C, DJ338D, DJ339, DJ34, DJ340, DJ340A, DJ340B, DJ340D, DJ340E, DJ340F, DJ340G, DJ340H, DJ340I, DJ340J, DJ341, DJ341A, DJ341B, DJ341C, DJ341D, DJ342, DJ343, DJ343A, DJ348, DJ348A, DJ348B, DJ348C, DJ35, DJ350, DJ351, DJ351A, DJ351B, DJ352, DJ353, DJ358, DJ359, DJ36, DJ369, DJ37, DJ370, DJ370A, DJ370B, DJ370C, DJ371, DJ38, DJ380, DJ380A, DJ380B, DJ380C, DJ380C1, DJ380C2, DJ381, DJ381A, DJ381B, DJ382, DJ382A, DJ383, DJ383A, DJ383B, DJ383C, DJ383D, DJ383E, DJ383F, DJ383V, DJ384, DJ384A, DJ384B, DJ384C, DJ384D, DJ385, DJ385A, DJ385B, DJ386, DJ387, DJ387A, DJ387B, DJ387C, DJ387D, DJ387E, DJ387F, DJ387G, DJ388, DJ388A, DJ388A1, DJ388A2, DJ388B, DJ388B1, DJ388B2, DJ388C, DJ388C1, DJ388C2, DJ39, DJ390, DJ390A, DJ390B, DJ390C, DJ391, DJ391A, DJ391B, DJ391C, DJ392, DJ392A, DJ392B, DJ392C, DJ392D, DJ398, DJ398A, DJ399"
Kroniske sygdomme i nedre luftveje [DJ40-DJ47],DJ40-DJ47,"DJ40, DJ409, DJ41, DJ410, DJ411, DJ418, DJ42, DJ429, DJ429A, DJ429B, DJ43, DJ430, DJ431, DJ431A, DJ432, DJ438, DJ439, DJ439A, DJ44, DJ440, DJ441, DJ448, DJ448A, DJ448B, DJ448C, DJ449, DJ45, DJ450, DJ450A, DJ451, DJ451A, DJ458, DJ459, DJ46, DJ469, DJ47, DJ479"
Lungesygdomme forårsaget af ydre agentia [DJ60-DJ70],DJ60-DJ70,"DJ60, DJ609, DJ609A, DJ61, DJ619, DJ62, DJ620, DJ628, DJ628A, DJ628B, DJ63, DJ630, DJ631, DJ632, DJ633, DJ634, DJ635, DJ638, DJ638A, DJ638B, DJ64, DJ649, DJ65, DJ659, DJ66, DJ660, DJ661, DJ662, DJ668, DJ67, DJ670, DJ671, DJ672, DJ673, DJ674, DJ675, DJ676, DJ677, DJ678, DJ678A, DJ678B, DJ678C, DJ678D, DJ678E, DJ679, DJ679A, DJ68, DJ680, DJ680B, DJ680C, DJ681, DJ682, DJ683, DJ684, DJ684A, DJ684B, DJ684C, DJ688, DJ689, DJ69, DJ690, DJ691, DJ698, DJ698A, DJ70, DJ700, DJ701, DJ702, DJ703, DJ704, DJ708, DJ709"
Andre lungesygdomme overvejende lokaliseret til bindevæv [DJ80-DJ84],DJ80-DJ84,"DJ80, DJ801, DJ809, DJ809A, DJ809B, DJ809C, DJ81, DJ819, DJ82, DJ821, DJ829, DJ84, DJ840, DJ840A, DJ840B, DJ841, DJ841A, DJ841B, DJ841C, DJ841D, DJ841F, DJ841G, DJ841H, DJ841X, DJ848, DJ848A, DJ849"
Sygdomme med pus og nekrose i nedre luftveje [DJ85-DJ86],DJ85-DJ86,"DJ85, DJ850, DJ851, DJ852, DJ853, DJ86, DJ860, DJ869"
Andre sygdomme i lungehinde [DJ90-DJ94],DJ90-DJ94,"DJ90, DJ909, DJ91, DJ919, DJ92, DJ920, DJ929, DJ93, DJ930, DJ931, DJ938, DJ939, DJ94, DJ940, DJ941, DJ942, DJ942A, DJ948, DJ948A, DJ949"
Andre sygdomme i åndedrætsorganer [DJ95-DJ99],DJ95-DJ99,"DJ95, DJ950, DJ950A, DJ950B, DJ950C, DJ950D, DJ951, DJ952, DJ953, DJ954, DJ955, DJ958, DJ958A, DJ959, DJ96, DJ960, DJ961, DJ969, DJ98, DJ980, DJ980A, DJ980B, DJ980C, DJ980D, DJ980E, DJ980F, DJ980G, DJ980H, DJ980I, DJ981, DJ982, DJ982A, DJ983, DJ984, DJ984A, DJ984B, DJ984C, DJ985, DJ985A, DJ985B, DJ985C, DJ985D, DJ986, DJ986A, DJ986B, DJ986C, DJ986D, DJ988, DJ988A, DJ989, DJ99, DJ990, DJ991, DJ998"
"Sygdomme i mundhulen, spytkirtler og kæber [DK00-DK14]",DK00-DK14,"DK00, DK000, DK000A, DK001, DK002, DK002A, DK002B, DK002C, DK002D, DK002E, DK002G, DK003, DK003A, DK004, DK004A, DK004B, DK005, DK005A, DK005B, DK005C, DK006, DK006A, DK006B, DK006C, DK006D, DK007, DK007A, DK008, DK008A, DK008B, DK009, DK01, DK010, DK011, DK02, DK020, DK021, DK022, DK023, DK024, DK025, DK028, DK029, DK03, DK030, DK031, DK032, DK033, DK033A, DK033B, DK033C, DK034, DK035, DK036, DK036A, DK036B, DK036C, DK037, DK038, DK038A, DK038B, DK038C, DK039, DK04, DK040, DK040A, DK040B, DK041, DK041A, DK042, DK043, DK044, DK045, DK045A, DK045B, DK046, DK046A, DK046B, DK046C, DK046D, DK046E, DK047, DK047A, DK047B, DK048, DK048A, DK048B, DK048C, DK049, DK05, DK050, DK051, DK051A, DK051B, DK051C, DK051D, DK052, DK052A, DK052B, DK052C, DK053, DK053A, DK053B, DK054, DK054A, DK055, DK056, DK06, DK060, DK061, DK061A, DK061B, DK062, DK062A, DK062B, DK068, DK068A, DK068B, DK068C, DK068D, DK068E, DK068F, DK068G, DK068H, DK068I, DK068K, DK068L, DK069, DK07, DK070, DK070A, DK070B, DK070C, DK070D, DK071, DK071A, DK071B, DK071C, DK071D, DK071E, DK071F, DK072, DK072A, DK072B, DK072C, DK072D, DK072E, DK072F, DK072G, DK072H, DK072I, DK072J, DK072K, DK072L, DK073, DK073A, DK073B, DK073C, DK073D, DK073E, DK073F, DK074, DK075, DK075A, DK075B, DK075C, DK076, DK076A, DK076B, DK076C, DK076D, DK076E, DK076F, DK076M, DK078, DK079, DK08, DK080, DK081, DK081A, DK081B, DK081C, DK081D, DK082, DK083, DK083A, DK088, DK088A, DK088B, DK088C, DK089, DK089A, DK09, DK090, DK090A, DK090B, DK090C, DK090D, DK091, DK091A, DK091B, DK091C, DK091D, DK091E, DK091F, DK092, DK092A, DK092B, DK092C, DK092D, DK092E, DK092F, DK092G, DK092H, DK092I, DK098, DK098A, DK098B, DK098C, DK098D, DK098E, DK099, DK10, DK100, DK100A, DK100B, DK100C, DK100D, DK100E, DK100F, DK100G, DK101, DK101A, DK101B, DK102, DK102A, DK102B, DK102C, DK102D, DK102E, DK102F, DK102G, DK102H, DK102I, DK102J, DK103, DK103B, DK108, DK108A, DK108B, DK108C, DK108D, DK108E, DK108F, DK108G, DK108H, DK108I, DK108J, DK109, DK11, DK110, DK110A, DK111, DK111A, DK111B, DK111C, DK112, DK112A, DK112B, DK112C, DK112D, DK113, DK113A, DK113B, DK113C, DK113D, DK114, DK114A, DK115, DK115A, DK116, DK116A, DK116B, DK116C, DK117, DK117A, DK117B, DK117C, DK117D, DK118, DK118A, DK118B, DK118C, DK118E, DK118F, DK118G, DK118H, DK118I, DK118J, DK119, DK12, DK120, DK120A, DK120B, DK120C, DK120D, DK121, DK121A, DK121B, DK121C, DK122, DK122A, DK122B, DK13, DK130, DK130A, DK130B, DK130C, DK130D, DK130E, DK130F, DK130G, DK130H, DK130I, DK130J, DK131, DK131A, DK131B, DK132, DK132A, DK132B, DK132C, DK132D, DK132E, DK132F, DK132G, DK132H, DK132I, DK132J, DK132K, DK132M, DK132N, DK133, DK134, DK134A, DK134B, DK134C, DK134D, DK134E, DK135, DK135A, DK136, DK137, DK137A, DK137B, DK137C, DK137D, DK137E, DK137F, DK14, DK140, DK140A, DK140B, DK140C, DK140D, DK141, DK142, DK143, DK143A, DK144, DK144A, DK145, DK145A, DK145B, DK146, DK146A, DK148, DK148A, DK148B, DK148C, DK148D, DK148F, DK148G, DK149"
"Sygdomme i spiserøret, mavesækken og tolvfingertarmen [DK20-DK31]",DK20-DK31,"DK20, DK209, DK209A, DK209B, DK209C, DK209D, DK21, DK210, DK219, DK219A, DK219B, DK22, DK220, DK221, DK221A, DK221B, DK221C, DK221D, DK221E, DK221F, DK222, DK222A, DK222B, DK222C, DK223, DK223A, DK224, DK224A, DK225, DK225A, DK225B, DK226, DK227, DK228, DK228A, DK228B, DK228C, DK228D, DK228E, DK228F, DK228G, DK228H, DK228I, DK228K, DK229, DK23, DK230, DK231, DK238, DK25, DK250, DK250A, DK250B, DK250C, DK250D, DK250E, DK250F, DK251, DK251A, DK251B, DK251C, DK251D, DK251E, DK252, DK252A, DK252B, DK252C, DK252D, DK252E, DK253, DK253A, DK253B, DK253C, DK253D, DK253E, DK254, DK254A, DK254B, DK254C, DK254D, DK254E, DK254F, DK254G, DK254H, DK254I, DK254J, DK255, DK255A, DK255B, DK255C, DK255D, DK255E, DK255F, DK255G, DK255H, DK255I, DK255J, DK256, DK256A, DK256B, DK256C, DK256D, DK256E, DK256F, DK256G, DK256H, DK256I, DK256J, DK257, DK257A, DK257B, DK257C, DK257D, DK257E, DK259, DK259A, DK26, DK260, DK260A, DK261, DK261A, DK262, DK262A, DK263, DK263A, DK264, DK264A, DK264B, DK264C, DK264D, DK265, DK265A, DK265B, DK265C, DK265D, DK266, DK266A, DK266B, DK266C, DK266D, DK267, DK267A, DK269, DK27, DK270, DK271, DK272, DK273, DK274, DK275, DK276, DK277, DK279, DK28, DK280, DK280A, DK280B, DK281, DK281A, DK281C, DK282, DK282A, DK282C, DK283, DK283A, DK283C, DK284, DK284A, DK284B, DK284C, DK284D, DK285, DK285A, DK285B, DK285C, DK285D, DK286, DK286A, DK286B, DK286C, DK286D, DK287, DK287A, DK287B, DK289, DK29, DK290, DK291, DK292, DK293, DK294, DK295, DK296, DK296A, DK296B, DK297, DK298, DK298A, DK299, DK30, DK309, DK31, DK310, DK310A, DK311, DK311A, DK312, DK312A, DK312B, DK312C, DK313, DK314, DK314A, DK315, DK315A, DK315B, DK316, DK316A, DK316B, DK316C, DK316D, DK316E, DK317, DK318, DK318A, DK318B, DK318C, DK318D, DK318E, DK318F, DK318G, DK318H, DK318J, DK319"
Sygdomme i blindtarmen [DK35-DK38],DK35-DK38,"DK35, DK352, DK353, DK353A, DK353B, DK358, DK358A, DK358B, DK358C, DK36, DK369, DK37, DK379, DK38, DK380, DK381, DK381A, DK382, DK383, DK388, DK388A, DK388B, DK388C, DK388D, DK389"
Hernier [DK40-DK46],DK40-DK46,"DK40, DK400, DK401, DK402, DK402A, DK403, DK403A, DK403B, DK404, DK409, DK41, DK410, DK411, DK412, DK412A, DK413, DK413A, DK413B, DK414, DK419, DK42, DK420, DK420A, DK420B, DK421, DK429, DK43, DK430, DK431, DK432, DK433, DK434, DK435, DK435A, DK435B, DK435C, DK435D, DK436, DK436A, DK436B, DK437, DK439, DK44, DK440, DK440A, DK440B, DK441, DK449, DK45, DK450, DK450B, DK450C, DK450D, DK450E, DK450F, DK450G, DK450H, DK450I, DK450J, DK450K, DK450L, DK450M, DK451, DK451B, DK451C, DK451D, DK451E, DK451F, DK451G, DK451H, DK451I, DK451J, DK451K, DK451L, DK451M, DK458, DK458B, DK458C, DK458D, DK458E, DK458F, DK458G, DK458H, DK458I, DK458J, DK458K, DK458L, DK458M, DK46, DK460, DK460A, DK460B, DK461, DK469, DK469A"
Ikke-infektiøs tyndtarms- og tyktarmskatar [DK50-DK52],DK50-DK52,"DK50, DK500, DK500A, DK500B, DK500C, DK500D, DK501, DK501D, DK508, DK508A, DK508C, DK508D, DK509, DK51, DK510, DK512, DK513, DK514, DK515, DK515A, DK515B, DK518, DK518B, DK519, DK52, DK520, DK520A, DK520B, DK521, DK521A, DK521B, DK521C, DK522, DK522A, DK522C, DK522D, DK522E, DK522F, DK523, DK528, DK528A, DK528B, DK528C, DK528D, DK528D1, DK528D2, DK529, DK529A, DK529B, DK529B1, DK529C, DK529D, DK529E, DK529F, DK529G, DK529H"
Andre tarmsygdomme [DK55-DK64],DK55-DK64,"DK55, DK550, DK550A, DK550B, DK550C, DK550D, DK550E, DK550F, DK550H, DK551, DK551A, DK551B, DK551C, DK551D, DK551E, DK551F, DK552, DK558, DK558A, DK558B, DK558C, DK558D, DK559, DK56, DK560, DK560A, DK560B, DK561, DK561A, DK561B, DK561C, DK561D, DK562, DK562A, DK562B, DK562C, DK563, DK564, DK564A, DK564B, DK565, DK565A, DK565B, DK565C, DK565D, DK565E, DK566, DK566A, DK566B, DK566C, DK566D, DK566E, DK566F, DK566G, DK566H, DK567, DK57, DK570, DK570A, DK570B, DK570C, DK571, DK571A, DK571B, DK572, DK572A, DK572B, DK572C, DK573, DK573A, DK573B, DK573C, DK573D, DK573E, DK573F, DK574, DK574A, DK575, DK578, DK579, DK579A, DK58, DK580, DK589, DK59, DK590, DK590A, DK591, DK592, DK593, DK593B, DK593C, DK593D, DK594, DK594A, DK598, DK598A, DK598B, DK598C, DK598D, DK598E, DK599, DK60, DK600, DK601, DK602, DK603, DK603A, DK603B, DK603D, DK603E, DK603F, DK604, DK604A, DK605, DK61, DK610, DK610A, DK610B, DK611, DK611A, DK612, DK613, DK614, DK62, DK620, DK621, DK622, DK623, DK624, DK624A, DK624B, DK624C, DK624D, DK624E, DK625, DK625A, DK625B, DK626, DK626A, DK626B, DK626C, DK627, DK628, DK628A, DK628B, DK628C, DK628D, DK628E, DK628F, DK628G, DK628H, DK628I, DK628J, DK628K, DK628L, DK628M, DK628N, DK628P, DK628P1, DK628P1A, DK628P1B, DK628P1C, DK628P2, DK628P2A, DK628P2B, DK628P2C, DK629, DK63, DK630, DK631, DK631A, DK632, DK632A, DK632B, DK632C, DK632D, DK632F, DK632G, DK632H, DK632I, DK632J, DK633, DK634, DK634A, DK634B, DK634C, DK635, DK638, DK638A, DK638B, DK638C, DK638D, DK638E, DK638F, DK639, DK64, DK640, DK641, DK642, DK643, DK644, DK645, DK648, DK649"
Sygdomme i bughinde [DK65-DK67],DK65-DK67,"DK65, DK650, DK650A, DK650B, DK650C, DK650D, DK650E, DK650F, DK650G, DK650H, DK650I, DK650J, DK650K, DK650L, DK650M, DK650N, DK650O, DK650P, DK658, DK658A, DK658B, DK658C, DK658E, DK658F, DK658G, DK658H, DK658I, DK659, DK66, DK660, DK660A, DK660B, DK660C, DK660D, DK660E, DK660F, DK661, DK668, DK668A, DK668C, DK669, DK67, DK670, DK671, DK672, DK673, DK678"
Sygdomme i leveren [DK70-DK77],DK70-DK77,"DK70, DK700, DK701, DK702, DK703, DK703A, DK704, DK704A, DK704B, DK704C, DK704D, DK709, DK71, DK710, DK710A, DK711, DK711A, DK711B, DK711C, DK712, DK712A, DK713, DK713A, DK714, DK714A, DK715, DK715A, DK715B, DK715D, DK716, DK716A, DK717, DK717A, DK717B, DK718, DK719, DK72, DK720, DK720A, DK720C, DK720D, DK720E, DK720F, DK721, DK729, DK729A, DK73, DK730, DK731, DK732, DK732B, DK732C, DK732D, DK732E, DK732F, DK732G, DK738, DK739, DK74, DK740, DK740A, DK740B, DK741, DK742, DK743, DK743A, DK744, DK745, DK746, DK746B, DK746C, DK746D, DK746E, DK746F, DK746G, DK746H, DK75, DK750, DK750A, DK750B, DK750C, DK750D, DK751, DK752, DK753, DK754, DK754A, DK758, DK759, DK759A, DK76, DK760, DK760A, DK760B, DK760C, DK761, DK761A, DK761B, DK762, DK763, DK764, DK764A, DK765, DK766, DK766A, DK766B, DK767, DK768, DK768A, DK768B, DK768C, DK768D, DK768E, DK769, DK77, DK770, DK778"
"Sygdomme i galdeblære, galdeveje og bugspytkirtel [DK80-DK87]",DK80-DK87,"DK80, DK800, DK800A, DK800D, DK801, DK801A, DK801C, DK802, DK802A, DK802D, DK802E, DK802F, DK803, DK803A, DK803B, DK803C, DK804, DK804A, DK804B, DK804C, DK804D, DK804E, DK805, DK805B, DK805C, DK805E, DK805F, DK805J, DK805K, DK808, DK81, DK810, DK810A, DK810B, DK810C, DK810D, DK811, DK818, DK819, DK82, DK820, DK820A, DK821, DK822, DK823, DK823A, DK823B, DK824, DK828, DK828A, DK828B, DK828C, DK828D, DK828E, DK828F, DK828G, DK828H, DK828I, DK828J, DK828K, DK828L, DK828M, DK829, DK83, DK830, DK830A, DK830B, DK830C, DK830D, DK830E, DK830F, DK830G, DK831, DK831B, DK832, DK833, DK833A, DK833B, DK833C, DK834, DK835, DK838, DK838A, DK838B, DK838C, DK838D, DK838E, DK838F, DK839, DK85, DK850, DK851, DK851A, DK852, DK853, DK858, DK858A, DK858B, DK858C, DK858D, DK858E, DK858F, DK859, DK86, DK860, DK861, DK861A, DK861B, DK861D, DK861E, DK861F, DK862, DK863, DK868, DK868A, DK868B, DK868C, DK868D, DK868E, DK868F, DK868G, DK868H, DK868I, DK868J, DK868K, DK868L, DK868M, DK869, DK87, DK870, DK871"
Andre sygdomme i fordøjelsessystem [DK90-DK93],DK90-DK93,"DK90, DK900, DK900B, DK901, DK901A, DK901B, DK902, DK903, DK904, DK904D, DK904E, DK904F, DK908, DK908A, DK908B, DK909, DK91, DK910, DK911, DK911A, DK912, DK912B, DK912C, DK913, DK913A, DK913B, DK913C, DK914, DK914A, DK914B, DK914C, DK914D, DK915, DK918, DK918A, DK918B, DK919, DK92, DK920, DK921, DK922, DK928, DK929, DK93, DK930, DK931, DK938"
Infektioner i hud og underhud [DL00-DL08],DL00-DL08,"DL00, DL009, DL009A, DL009B, DL009C, DL01, DL010, DL010A, DL010B, DL010C, DL011, DL02, DL020, DL020A, DL020B, DL020C, DL021, DL021A, DL021B, DL021C, DL022, DL022A, DL022B, DL022C, DL022D, DL022E, DL022F, DL022G, DL022H, DL022I, DL022J, DL022K, DL022L, DL022M, DL022N, DL022O, DL022P, DL022Q, DL022R, DL022S, DL022T, DL023, DL023A, DL023B, DL023C, DL024, DL024A, DL024B, DL024C, DL024D, DL024E, DL024F, DL024G, DL024H, DL024I, DL024J, DL024K, DL024L, DL024M, DL028, DL028A, DL028B, DL028C, DL029, DL029A, DL029B, DL029C, DL03, DL030, DL030A, DL030B, DL030C, DL030D, DL030E, DL030F, DL030G, DL030H, DL030I, DL030J, DL030K, DL031, DL031A, DL031B, DL031C, DL031D, DL031E, DL031F, DL031G, DL031H, DL031I, DL032, DL033, DL033A, DL033B, DL033C, DL033D, DL033E, DL033F, DL038, DL038A, DL038B, DL039, DL04, DL040, DL040A, DL040B, DL040C, DL041, DL042, DL042A, DL043, DL048, DL049, DL05, DL050, DL059, DL08, DL080, DL080A, DL080B, DL080C, DL081, DL088, DL088C, DL088D, DL089"
Blæreudslæt [DL10-DL14],DL10-DL14,"DL10, DL100, DL101, DL102, DL103, DL104, DL105, DL108, DL108A, DL109, DL11, DL110, DL111, DL118, DL119, DL12, DL120, DL121, DL121A, DL122, DL122A, DL123, DL128, DL129, DL13, DL130, DL131, DL138, DL138A, DL138B, DL138C, DL139, DL14, DL149"
Dermatitis og eksem [DL20-DL30],DL20-DL30,"DL20, DL200, DL208, DL208B, DL208C, DL208D, DL209, DL21, DL210, DL210B, DL210C, DL210D, DL210E, DL211, DL211A, DL218, DL218A, DL218B, DL218D, DL218E, DL218F, DL219, DL22, DL229, DL229B, DL23, DL230, DL230A, DL230B, DL230C, DL230D, DL230E, DL231, DL231A, DL232, DL232A, DL232B, DL232C, DL232D, DL232E, DL233, DL233A, DL234, DL234A, DL235, DL235A, DL235B, DL235C, DL235D, DL235E, DL235F, DL235G, DL235H, DL235I, DL236, DL236A, DL237, DL237A, DL238, DL238A, DL238B, DL238C, DL239, DL239A, DL24, DL240, DL240A, DL241, DL241A, DL242, DL242A, DL243, DL243A, DL244, DL244A, DL245, DL245A, DL245B, DL245C, DL245D, DL245E, DL246, DL246A, DL247, DL247A, DL248, DL248A, DL249, DL249A, DL25, DL250, DL251, DL252, DL253, DL253A, DL253B, DL254, DL255, DL258, DL259, DL259A, DL26, DL269, DL269B, DL27, DL270, DL270A, DL270B, DL271, DL271A, DL271B, DL271C, DL272, DL278, DL278A, DL278B, DL279, DL28, DL280, DL280A, DL280B, DL280C, DL281, DL282, DL282A, DL282B, DL282C, DL282D, DL29, DL290, DL291, DL292, DL293, DL298, DL298A, DL298B, DL298C, DL298D, DL299, DL30, DL300, DL301, DL301A, DL301B, DL301C, DL302, DL302A, DL303, DL304, DL305, DL305A, DL308, DL308A, DL308B, DL308D, DL308F, DL308G, DL308H, DL308I, DL309"
Papuloskvamøse sygdomme [DL40-DL45],DL40-DL45,"DL40, DL400, DL400B, DL400C, DL400D, DL401, DL401B, DL402, DL402B, DL403, DL403A, DL403B, DL404, DL405, DL408, DL408A, DL408B, DL408C, DL408D, DL408E, DL409, DL41, DL410, DL411, DL413, DL414, DL415, DL418, DL418A, DL419, DL42, DL429, DL429A, DL429B, DL43, DL430, DL431, DL432, DL433, DL438, DL438A, DL438B, DL438C, DL438D, DL438E, DL439, DL44, DL440, DL441, DL442, DL443, DL444, DL444A, DL448, DL448A, DL448B, DL448C, DL448D, DL449, DL45, DL459"
Nældefeber og erytem [DL50-DL54],DL50-DL54,"DL50, DL500, DL501, DL502, DL502A, DL502B, DL503, DL504, DL505, DL506, DL506A, DL508, DL508A, DL508B, DL508C, DL508D, DL508E, DL509, DL51, DL510, DL511, DL511A, DL512, DL518, DL518A, DL519, DL52, DL529, DL53, DL530, DL531, DL532, DL533, DL538, DL538A, DL538B, DL538C, DL539, DL539A, DL539B, DL54, DL540, DL548"
