Description,SKSCodes_range,SKSCodes
Sygdomme i hud og underhud forårsaget af stråling [DL55-DL59],DL55-DL59,"DL55, DL550, DL551, DL552, DL558, DL559, DL56, DL560, DL561, DL562, DL562B, DL562C, DL562D, DL563, DL564, DL568, DL568A, DL568B, DL568C, DL569, DL57, DL570, DL570A, DL570B, DL570C, DL571, DL572, DL573, DL574, DL574B, DL575, DL578, DL578A, DL578B, DL578C, DL579, DL58, DL580, DL581, DL589, DL59, DL590, DL598, DL598A, DL599"
"Sygdomme i hår, negle og hudkirtler [DL60-DL75]",DL60-DL75,"DL60, DL600, DL601, DL602, DL603, DL603A, DL603B, DL604, DL605, DL608, DL608A, DL608B, DL608C, DL608D, DL608E, DL608F, DL608G, DL608H, DL608I, DL609, DL62, DL620, DL628, DL628A, DL63, DL630, DL631, DL632, DL638, DL638A, DL639, DL64, DL640, DL648, DL649, DL65, DL650, DL651, DL652, DL658, DL658B, DL658C, DL659, DL66, DL660, DL661, DL662, DL663, DL664, DL668, DL668A, DL669, DL67, DL670, DL671, DL671A, DL671B, DL671C, DL671D, DL678, DL678A, DL678B, DL678C, DL678D, DL679, DL68, DL680, DL681, DL682, DL683, DL688, DL689, DL70, DL700, DL701, DL702, DL702A, DL703, DL704, DL705, DL708, DL708A, DL708B, DL708C, DL708D, DL708E, DL708F, DL708G, DL708H, DL708I, DL709, DL71, DL710, DL711, DL718, DL718A, DL718B, DL718D, DL718E, DL719, DL72, DL720, DL721, DL721A, DL721B, DL722, DL728, DL729, DL73, DL730, DL731, DL732, DL738, DL738A, DL738B, DL738C, DL738D, DL738E, DL738F, DL738G, DL738H, DL739, DL74, DL740, DL741, DL742, DL742A, DL743, DL743A, DL743B, DL744, DL744A, DL748, DL748A, DL749, DL75, DL750, DL751, DL752, DL752A, DL758, DL759"
Andre sygdomme i hud og underhud [DL80-DL99],DL80-DL99,"DL80, DL809, DL81, DL810, DL811, DL811A, DL812, DL813, DL814, DL814A, DL814B, DL814C, DL814D, DL814E, DL814EA, DL814EB, DL814EC, DL814F, DL814G, DL815, DL815A, DL816, DL816A, DL816B, DL816C, DL817, DL817A, DL817B, DL817C, DL817E, DL817F, DL817G, DL818, DL818B, DL818D, DL818E, DL818G, DL818H, DL818I, DL818M, DL819, DL82, DL829, DL829A, DL829B, DL83, DL839, DL839A, DL839B, DL839C, DL839D, DL84, DL849, DL849A, DL849B, DL85, DL850, DL851, DL852, DL853, DL853A, DL858, DL858A, DL858B, DL858C, DL858D, DL858E, DL858F, DL858G, DL858H, DL858I, DL858J, DL858K, DL858L, DL858M, DL858N, DL858O, DL858P, DL858Q, DL859, DL86, DL869, DL87, DL870, DL871, DL872, DL878, DL878A, DL879, DL88, DL889, DL889C, DL89, DL890, DL890A, DL891, DL891A, DL892, DL892A, DL893, DL893A, DL899, DL90, DL900, DL900A, DL900B, DL901, DL902, DL903, DL904, DL905, DL905A, DL905B, DL905C, DL905D, DL906, DL906A, DL906B, DL906C, DL908, DL908B, DL908C, DL908D, DL908E, DL908F, DL908G, DL908H, DL908I, DL908J, DL908K, DL909, DL91, DL910, DL910A, DL918, DL918A, DL918B, DL919, DL92, DL920, DL920A, DL920B, DL920C, DL921, DL921A, DL922, DL923, DL923A, DL923B, DL928, DL928A, DL928B, DL928C, DL928D, DL928E, DL928F, DL928G, DL929, DL929A, DL929B, DL93, DL930, DL930A, DL931, DL932, DL932A, DL932B, DL932C, DL94, DL940, DL940B, DL941, DL942, DL942B, DL943, DL944, DL945, DL946, DL948, DL949, DL95, DL950, DL950A, DL951, DL958, DL958A, DL958B, DL959, DL97, DL979, DL979A, DL979B, DL979C, DL979E, DL98, DL980, DL981, DL981A, DL981B, DL982, DL983, DL984, DL984A, DL984B, DL984C, DL984D, DL984E, DL985, DL985A, DL985B, DL985C, DL985D, DL985E, DL985F, DL985G, DL985H, DL986, DL987, DL987A, DL987B, DL988, DL988A, DL988B, DL988D, DL988E, DL989, DL99, DL990, DL990A, DL990B, DL990C, DL998, DL998A, DL998B"
"Infektiøse, reaktive og postinfektiøse artritter [DM00-DM03]",DM00-DM03,"DM00, DM000, DM000A, DM000B, DM001, DM001A, DM001B, DM002, DM002A, DM002B, DM008, DM009, DM01, DM010, DM011, DM012, DM013, DM014, DM015, DM016, DM018, DM02, DM020, DM021, DM022, DM023, DM028, DM029, DM03, DM030, DM031, DM031A, DM032, DM032A, DM032B, DM036"
Inflammatoriske polyartritter [DM05-DM14],DM05-DM14,"DM05, DM050, DM051, DM051A, DM051B, DM051C, DM051D, DM051E, DM051F, DM052, DM053, DM058, DM059, DM06, DM060, DM061, DM062, DM063, DM064, DM068, DM069, DM07, DM070, DM071, DM072, DM073, DM073A, DM073B, DM074, DM075, DM076, DM08, DM080, DM080A, DM080B, DM081, DM082, DM082A, DM082B, DM083, DM084, DM088, DM088A, DM089, DM09, DM090, DM091, DM092, DM098, DM10, DM100, DM100A, DM100B, DM100C, DM100D, DM101, DM102, DM103, DM104, DM109, DM11, DM110, DM111, DM112, DM112A, DM118, DM119, DM12, DM120, DM121, DM122, DM123, DM124, DM125, DM128, DM128A, DM13, DM130, DM131, DM131A, DM138, DM138A, DM139, DM14, DM140, DM141, DM142, DM143, DM144, DM145, DM146, DM148"
Slidgigt [DM15-DM19],DM15-DM19,"DM15, DM150, DM151, DM152, DM153, DM153A, DM154, DM158, DM159, DM16, DM160, DM161, DM161A, DM162, DM163, DM163A, DM164, DM165, DM165A, DM166, DM167, DM167A, DM169, DM17, DM170, DM171, DM171B, DM172, DM173, DM173A, DM174, DM175, DM175A, DM179, DM18, DM180, DM181, DM181A, DM182, DM183, DM183A, DM184, DM185, DM185A, DM189, DM19, DM190, DM190A, DM191, DM191A, DM192, DM192A, DM198, DM198A, DM199"
Andre ledsygdomme [DM20-DM25],DM20-DM25,"DM20, DM200, DM200A, DM200B, DM200C, DM200E, DM200F, DM201, DM201A, DM202, DM203, DM203A, DM203B, DM203C, DM204, DM205, DM205A, DM205B, DM205C, DM205E, DM206, DM21, DM210, DM211, DM212, DM213, DM214, DM215, DM215A, DM215D, DM215E, DM215F, DM215G, DM216, DM216H, DM216I, DM216J, DM216K, DM216L, DM216M, DM216N, DM216O, DM216P, DM217, DM218, DM218A, DM218B, DM218C, DM218D, DM218E, DM218F, DM218G, DM218H, DM218J, DM219, DM22, DM220, DM221, DM222, DM222A, DM223, DM224, DM228, DM228A, DM229, DM23, DM230, DM231, DM232, DM233, DM233A, DM233B, DM234, DM235, DM236, DM236A, DM236B, DM236C, DM236D, DM238, DM238A, DM238B, DM239, DM24, DM240, DM241, DM242, DM242A, DM242B, DM243, DM243A, DM243B, DM244, DM244A, DM244B, DM244C, DM244D, DM244E, DM244E1, DM244E2, DM245, DM246, DM246A, DM246B, DM246C, DM246D, DM246E, DM246F, DM246G, DM246H, DM246I, DM246J, DM246K, DM246L, DM246M, DM246N, DM246O, DM247, DM248, DM248A, DM249, DM25, DM250, DM251, DM252, DM253, DM254, DM255, DM256, DM256A, DM257, DM258, DM258B, DM259"
Generaliserede bindevævssygdomme [DM30-DM36],DM30-DM36,"DM30, DM300, DM301, DM301A, DM302, DM303, DM308, DM308A, DM31, DM310, DM310A, DM310B, DM311, DM311A, DM311B, DM312, DM313, DM313A, DM314, DM315, DM315A, DM316, DM316A, DM317, DM318, DM318A, DM319, DM32, DM320, DM321, DM328, DM329, DM33, DM330, DM331, DM332, DM339, DM34, DM340, DM341, DM342, DM342A, DM342B, DM348, DM348B, DM349, DM35, DM350, DM350A, DM350B, DM350C, DM350D, DM350E, DM351, DM351A, DM351B, DM352, DM353, DM354, DM355, DM356, DM357, DM358, DM359, DM36, DM360, DM361, DM362, DM363, DM364, DM368"
Deformerende rygsygdomme [DM40-DM43],DM40-DM43,"DM40, DM400, DM401, DM401A, DM402, DM402A, DM403, DM404, DM404A, DM404B, DM404C, DM405, DM41, DM410, DM410A, DM411, DM411A, DM412, DM413, DM413A, DM414, DM414A, DM414B, DM414C, DM414D, DM414E, DM414F, DM415, DM415A, DM415B, DM418, DM419, DM42, DM420, DM421, DM429, DM43, DM430, DM431, DM432, DM432A, DM433, DM434, DM434A, DM435, DM436, DM438, DM439"
Spondylopatier [DM45-DM49],DM45-DM49,"DM45, DM459, DM46, DM460, DM461, DM462, DM463, DM463A, DM464, DM465, DM465A, DM468, DM468A, DM469, DM47, DM470, DM470A, DM471, DM471A, DM471B, DM471C, DM472, DM472A, DM472B, DM478, DM478A, DM478B, DM478C, DM478D, DM478E, DM479, DM48, DM480, DM481, DM481A, DM482, DM483, DM484, DM485, DM485A, DM488, DM488A, DM489, DM49, DM490, DM491, DM492, DM493, DM494, DM495, DM498"
Andre ryglidelser [DM50-DM54],DM50-DM54,"DM50, DM500, DM500A, DM500B, DM500C, DM500D, DM500E, DM500F, DM501, DM501A, DM501B, DM501C, DM501D, DM501E, DM501F, DM502, DM503, DM508, DM509, DM51, DM510, DM510A, DM510G, DM511, DM511A, DM511B, DM511C, DM511D, DM511E, DM511F, DM511H, DM511I, DM512, DM512A, DM512B, DM512C, DM512D, DM512E, DM512F, DM512G, DM513, DM513A, DM513B, DM513C, DM514, DM518, DM519, DM53, DM530, DM530A, DM531, DM532, DM532A, DM533, DM533A, DM533B, DM538, DM539, DM54, DM540, DM540A, DM540B, DM541, DM541A, DM541B, DM541C, DM541D, DM542, DM543, DM544, DM545, DM546, DM548, DM549"
Sygdomme i muskler [DM60-DM63],DM60-DM63,"DM60, DM600, DM600A, DM601, DM602, DM608, DM608A, DM608A1, DM609, DM61, DM610, DM611, DM612, DM613, DM614, DM615, DM619, DM62, DM620, DM620A, DM621, DM621A, DM622, DM622A, DM623, DM624, DM625, DM625A, DM626, DM626A, DM628, DM628A, DM628B, DM629, DM63, DM630, DM631, DM632, DM633, DM638"
Sygdomme i ledkapselhinder og sener [DM65-DM68],DM65-DM68,"DM65, DM650, DM651, DM652, DM653, DM654, DM658, DM658A, DM658B, DM659, DM659A, DM659B, DM66, DM660, DM661, DM661A, DM662, DM663, DM664, DM665, DM67, DM670, DM671, DM672, DM673, DM673A, DM674, DM678, DM679, DM68, DM680, DM680G, DM680H, DM688"
Anden bløddelsreumatisme [DM70-DM79],DM70-DM79,"DM70, DM700, DM700A, DM700B, DM701, DM702, DM703, DM704, DM705, DM705A, DM706, DM706A, DM707, DM707A, DM708, DM709, DM71, DM710, DM711, DM712, DM713, DM713A, DM713B, DM713B1, DM713B2, DM713C, DM713C1, DM713C2, DM713D, DM713D1, DM713D2, DM714, DM715, DM718, DM719, DM719A, DM72, DM720, DM720A, DM721, DM722, DM724, DM724A, DM726, DM728, DM728A, DM728B, DM728C, DM728D, DM729, DM729A, DM729B, DM73, DM730, DM731, DM738, DM75, DM750, DM751, DM751A, DM751B, DM751C, DM752, DM753, DM753A, DM754, DM755, DM755A, DM758, DM759, DM76, DM760, DM761, DM762, DM763, DM763A, DM763B, DM764, DM765, DM766, DM766A, DM767, DM768, DM768A, DM768B, DM769, DM77, DM770, DM771, DM772, DM773, DM774, DM775, DM778, DM779, DM779A, DM79, DM790, DM791, DM792, DM792A, DM792B, DM793, DM793A, DM793B, DM793C, DM793D, DM793E, DM794, DM795, DM796, DM797, DM797A, DM798, DM798A, DM798B, DM798C, DM798D, DM799"
Forstyrrelser i knogletæthed og struktur [DM80-DM85],DM80-DM85,"DM80, DM800, DM801, DM802, DM803, DM804, DM805, DM808, DM809, DM809A, DM809B, DM809C, DM81, DM810, DM811, DM812, DM813, DM814, DM815, DM816, DM818, DM818A, DM819, DM82, DM820, DM821, DM828, DM83, DM830, DM831, DM832, DM832A, DM833, DM834, DM835, DM838, DM839, DM84, DM840, DM841, DM842, DM843, DM844, DM844A, DM845, DM848, DM849, DM85, DM850, DM851, DM852, DM852A, DM853, DM854, DM855, DM856, DM858, DM858A, DM859"
Andre sygdomme i knogle [DM86-DM90],DM86-DM90,"DM86, DM860, DM861, DM862, DM863, DM864, DM865, DM865A, DM866, DM868, DM868A, DM869, DM869A, DM869B, DM869C, DM87, DM870, DM871, DM872, DM873, DM878, DM879, DM88, DM880, DM888, DM889, DM89, DM890, DM891, DM892, DM893, DM894, DM894A, DM894B, DM894C, DM895, DM896, DM898, DM898A, DM898B, DM899, DM90, DM900, DM901, DM902, DM903, DM904, DM905, DM906, DM907, DM908"
Sygdomme i brusk [DM91-DM94],DM91-DM94,"DM91, DM910, DM910A, DM910B, DM910C, DM910D, DM911, DM912, DM913, DM918, DM918A, DM919, DM92, DM920, DM920A, DM920B, DM921, DM921A, DM921B, DM921C, DM921D, DM922, DM922A, DM922B, DM922C, DM923, DM924, DM925, DM925A, DM925B, DM926, DM926B, DM926C, DM926D, DM927, DM927A, DM928, DM928A, DM929, DM93, DM930, DM931, DM932, DM932A, DM932B, DM938, DM939, DM94, DM940, DM941, DM942, DM943, DM948, DM948A, DM948B, DM948D, DM948E, DM948F, DM948G, DM948H, DM949"
"Andre sygdomme i knogler, muskler og bindevæv [DM95-DM99]",DM95-DM99,"DM95, DM950, DM951, DM952, DM952A, DM952B, DM953, DM954, DM954A, DM954B, DM955, DM958, DM959, DM96, DM960, DM960A, DM960B, DM961, DM962, DM963, DM964, DM965, DM966, DM968, DM968A, DM969, DM99, DM990, DM990A, DM990B, DM991, DM992, DM993, DM994, DM995, DM996, DM997, DM998, DM999"
Glomerulære sygdomme [DN00-DN08],DN00-DN08,"DN00, DN000, DN001, DN002, DN003, DN004, DN005, DN006, DN007, DN008, DN008A, DN009, DN01, DN010, DN011, DN012, DN013, DN014, DN015, DN016, DN017, DN018, DN018A, DN019, DN02, DN020, DN021, DN022, DN023, DN024, DN025, DN026, DN027, DN028, DN028C, DN029, DN029A, DN029B, DN03, DN030, DN031, DN032, DN033, DN034, DN035, DN036, DN037, DN038, DN038A, DN039, DN04, DN040, DN041, DN042, DN043, DN044, DN045, DN046, DN047, DN048, DN048A, DN049, DN05, DN050, DN051, DN052, DN053, DN054, DN055, DN056, DN057, DN058, DN058A, DN059, DN06, DN060, DN061, DN062, DN063, DN064, DN065, DN066, DN067, DN068, DN068A, DN069, DN07, DN070, DN071, DN072, DN073, DN074, DN075, DN076, DN077, DN078, DN078A, DN079, DN08, DN080, DN081, DN082, DN083, DN084, DN085, DN088"
Tubulointerstitielle nyresygdomme [DN10-DN16],DN10-DN16,"DN10, DN109, DN109A, DN109B, DN109C, DN11, DN110, DN110A, DN111, DN111A, DN111B, DN118, DN118A, DN118B, DN118C, DN118D, DN119, DN12, DN129, DN13, DN130, DN131, DN131A, DN132, DN132A, DN132B, DN133, DN133A, DN134, DN135, DN135A, DN135B, DN136, DN136A, DN136B, DN136C, DN136D, DN136E, DN137, DN138, DN138A, DN139, DN139A, DN139B, DN139C, DN14, DN140, DN140A, DN141, DN142, DN143, DN144, DN15, DN150, DN151, DN151A, DN151B, DN158, DN159, DN16, DN160, DN161, DN162, DN163, DN164, DN165, DN168"
Nyreinsufficiens [DN17-DN19],DN17-DN19,"DN17, DN170, DN171, DN172, DN178, DN179, DN18, DN181, DN182, DN183, DN184, DN185, DN189, DN19, DN199"
Urinvejssten [DN20-DN23],DN20-DN23,"DN20, DN200, DN200A, DN200F, DN200I, DN200M, DN200S, DN200X, DN200X1, DN200X2, DN200Y, DN200Z, DN201, DN201A, DN201F, DN201I, DN201M, DN201S, DN201X, DN201X1, DN201X2, DN201Y, DN201Z, DN202, DN202A, DN202F, DN202I, DN202M, DN202S, DN202X, DN202X1, DN202X2, DN202Y, DN202Z, DN209, DN209A, DN21, DN210, DN210A, DN211, DN218, DN219, DN22, DN220, DN228, DN23, DN239"
Andre sygdomme i nyre og urinleder [DN25-DN29],DN25-DN29,"DN25, DN250, DN250B, DN251, DN258, DN258A, DN258B, DN258C, DN259, DN26, DN269, DN27, DN270, DN271, DN279, DN28, DN280, DN280A, DN280B, DN280C, DN280D, DN281, DN288, DN288A, DN288B, DN288C, DN288D, DN288E, DN288F, DN288G, DN288H, DN288J, DN289, DN289A, DN29, DN290, DN291, DN298"
Andre sygdomme i urinvejene [DN30-DN39],DN30-DN39,"DN30, DN300, DN301, DN302, DN303, DN303A, DN304, DN308, DN308A, DN308B, DN308C, DN308D, DN308E, DN308F, DN308G, DN308H, DN308J, DN308K, DN309, DN31, DN310, DN311, DN312, DN318, DN318A, DN319, DN32, DN320, DN320A, DN320B, DN321, DN321A, DN322, DN323, DN324, DN328, DN328A, DN328B, DN328C, DN328D, DN328E, DN328F, DN329, DN33, DN330, DN338, DN34, DN340, DN340B, DN340C, DN341, DN342, DN342A, DN342B, DN342C, DN342D, DN342E, DN342F, DN342G, DN343, DN35, DN350, DN350A, DN351, DN358, DN358A, DN359, DN36, DN360, DN360A, DN360B, DN360C, DN361, DN362, DN363, DN363A, DN368, DN368A, DN368B, DN368D, DN368E, DN369, DN37, DN370, DN378, DN39, DN390, DN390A, DN390B, DN391, DN392, DN393, DN394, DN394A, DN394B, DN394C, DN398, DN398A, DN399, DN399A"
Sygdomme i mandlige kønsorganer [DN40-DN51],DN40-DN51,"DN40, DN409, DN409B, DN409E, DN409G, DN41, DN410, DN411, DN412, DN412A, DN413, DN413A, DN418, DN419, DN42, DN420, DN421, DN422, DN423, DN428, DN428A, DN429, DN43, DN430, DN431, DN432, DN433, DN434, DN44, DN449, DN449A, DN449B, DN449C, DN449D, DN449E, DN45, DN450, DN450A, DN450B, DN450C, DN459, DN459A, DN459B, DN459C, DN459D, DN459E, DN46, DN469, DN469A, DN469B, DN469C, DN469D, DN469E, DN469W, DN47, DN479, DN479A, DN479B, DN479C, DN479D, DN479E, DN48, DN480, DN480A, DN480B, DN481, DN481A, DN481B, DN481C, DN481D, DN482, DN482A, DN482B, DN482C, DN482D, DN482E, DN482F, DN482G, DN482H, DN482I, DN483, DN484, DN485, DN485A, DN485B, DN486, DN486A, DN488, DN488A, DN488B, DN488C, DN488D, DN488E, DN488F, DN488G, DN488H, DN488J, DN488K, DN489, DN49, DN490, DN491, DN491A, DN491B, DN491C, DN491D, DN492, DN492A, DN492B, DN492C, DN492D, DN498, DN498A, DN498B, DN498C, DN498M, DN499, DN50, DN500, DN501, DN501A, DN501B, DN501C, DN501D, DN501E, DN501F, DN502, DN502A, DN502B, DN502C, DN508, DN508A, DN508B, DN508C, DN508D, DN508E, DN508F, DN508G, DN508H, DN508I, DN508J, DN508K, DN508L, DN508M, DN508N, DN508O, DN508P, DN508Q, DN508R, DN508S, DN508T, DN508U, DN508V, DN508X, DN508Y, DN509, DN51, DN510, DN511, DN511K, DN511L, DN512, DN518"
Sygdomme i brystkirtel [DN60-DN64],DN60-DN64,"DN60, DN600, DN600A, DN601, DN602, DN603, DN603A, DN603B, DN604, DN608, DN608A, DN609, DN61, DN619, DN619A, DN619B, DN619E, DN62, DN629, DN629A, DN629B, DN629D, DN629E, DN63, DN639, DN64, DN640, DN640A, DN640B, DN641, DN642, DN643, DN644, DN644A, DN644B, DN645, DN645A, DN645B, DN645C, DN645D, DN648, DN648A, DN648D, DN648E, DN648F, DN648G, DN648H, DN649"
Underlivsbetændelse [DN70-DN77],DN70-DN77,"DN70, DN700, DN700A, DN700B, DN700C, DN700D, DN700E, DN700F, DN700G, DN701, DN701A, DN701B, DN701C, DN701D, DN701E, DN701F, DN701G, DN701H, DN709, DN709A, DN709B, DN709C, DN71, DN710, DN710A, DN710C, DN710D, DN710E, DN710F, DN711, DN711A, DN711B, DN711D, DN711E, DN711F, DN719, DN72, DN729, DN729A, DN729B, DN729C, DN729D, DN729E, DN729F, DN73, DN730, DN730A, DN730B, DN730C, DN730D, DN730E, DN731, DN731A, DN731B, DN731C, DN731D, DN731E, DN732, DN732A, DN732B, DN732C, DN732D, DN732E, DN733, DN733A, DN734, DN734A, DN735, DN735A, DN736, DN736A, DN736B, DN738, DN738A, DN738B, DN738C, DN739, DN74, DN740, DN741, DN741A, DN742, DN743, DN744, DN748, DN75, DN750, DN751, DN758, DN758A, DN758B, DN758C, DN759, DN76, DN760, DN760B, DN760C, DN760D, DN760E, DN761, DN761A, DN761B, DN761C, DN761D, DN761E, DN762, DN762A, DN763, DN763A, DN763B, DN764, DN764A, DN764B, DN764C, DN764D, DN764E, DN765, DN766, DN766A, DN768, DN768A, DN768B, DN768C, DN77, DN770, DN771, DN771P, DN771Q, DN771R, DN778"
Ikke-inflammatoriske sygdomme i kvindelige kønsorganer [DN80-DN98],DN80-DN98,"DN80, DN800, DN801, DN802, DN803, DN804, DN804A, DN804B, DN805, DN805A, DN805B, DN805C, DN806, DN808, DN808A, DN808B, DN808C, DN808D, DN809, DN81, DN810, DN811, DN812, DN813, DN813A, DN814, DN815, DN815A, DN816, DN816A, DN817, DN818, DN818A, DN818B, DN818C, DN818D, DN819, DN82, DN820, DN821, DN821A, DN821B, DN821C, DN821D, DN821E, DN822, DN823, DN823A, DN824, DN824A, DN824B, DN825, DN825A, DN825B, DN825C, DN825D, DN825E, DN825F, DN828, DN828A, DN828B, DN828C, DN828D, DN828E, DN828F, DN829, DN83, DN830, DN830A, DN831, DN831A, DN831B, DN832, DN832A, DN832B, DN832C, DN832D, DN832X, DN833, DN833A, DN833B, DN834, DN834A, DN834B, DN834C, DN835, DN835A, DN835B, DN835C, DN835D, DN835E, DN836, DN837, DN838, DN838A, DN838B, DN838C, DN838D, DN838E, DN838F, DN838G, DN838H, DN838I, DN838J, DN838K, DN839, DN84, DN840, DN840A, DN840B, DN841, DN841A, DN842, DN843, DN843A, DN843B, DN848, DN849, DN85, DN850, DN850A, DN850B, DN851, DN852, DN852A, DN853, DN854, DN854A, DN854B, DN854C, DN855, DN856, DN857, DN857A, DN858, DN858A, DN858B, DN858C, DN858E, DN858F, DN858G, DN858H, DN858I, DN858J, DN858K, DN858L, DN858M, DN858N, DN858O, DN859, DN86, DN869, DN869A, DN869B, DN869C, DN869D, DN869E, DN87, DN870, DN871, DN872, DN879, DN88, DN880, DN881, DN881A, DN881B, DN881C, DN882, DN882A, DN882B, DN883, DN884, DN888, DN888A, DN888B, DN888C, DN888D, DN888E, DN888F, DN888G, DN888H, DN889, DN89, DN890, DN891, DN892, DN893, DN894, DN895, DN895A, DN895B, DN895C, DN895D, DN895E, DN896, DN896A, DN896B, DN897, DN897A, DN897B, DN898, DN898A, DN898B, DN898C, DN898D, DN898E, DN898F, DN898G, DN898H, DN898J, DN899, DN90, DN900, DN900A, DN901, DN902, DN902A, DN902B, DN903, DN904, DN904A, DN905, DN905A, DN906, DN907, DN908, DN908A, DN908B, DN908C, DN908D, DN908E, DN908F, DN908G, DN909, DN909A, DN909B, DN91, DN910, DN911, DN912, DN913, DN913A, DN913C, DN914, DN914A, DN914C, DN915, DN915A, DN915C, DN92, DN920, DN920A, DN920B, DN920C, DN921, DN921A, DN921B, DN922, DN922A, DN923, DN924, DN924A, DN924B, DN925, DN925A, DN925B, DN926, DN93, DN930, DN930A, DN930B, DN938, DN938A, DN938B, DN939, DN939A, DN939B, DN94, DN940, DN941, DN942, DN943, DN944, DN945, DN946, DN948, DN948A, DN949, DN95, DN950, DN951, DN951A, DN951B, DN951C, DN951D, DN951E, DN952, DN952A, DN953, DN958, DN959, DN96, DN969, DN97, DN970, DN971, DN972, DN973, DN974, DN978, DN978A, DN978B, DN978B1, DN978C, DN978D, DN978E, DN978F, DN979, DN98, DN980, DN981, DN981A, DN981B, DN981C, DN981D, DN982, DN983, DN984, DN985, DN986, DN988, DN989"
Andre sygdomme i urin- og kønsorganer [DN99-DN99],DN99-DN99,"DN99, DN990, DN991, DN991A, DN991B, DN992, DN993, DN994, DN995, DN998, DN998A, DN998A1, DN998A2, DN999"
"Graviditet, der ender med abort [DO00-DO08]",DO00-DO08,"DO00, DO000, DO001, DO002, DO003, DO003A, DO003B, DO008, DO008A, DO008B, DO008C, DO008D, DO008E, DO009, DO01, DO010, DO011, DO019, DO019A, DO02, DO020, DO021, DO022, DO028, DO029, DO03, DO030, DO031, DO032, DO033, DO034, DO035, DO036, DO037, DO038, DO039, DO04, DO049, DO05, DO050, DO059, DO06, DO069, DO07, DO079, DO08, DO080, DO080B, DO080O, DO080U, DO081, DO081G, DO082, DO083, DO084, DO085, DO086, DO086R, DO087, DO088, DO088L, DO089"
"Ødem, proteinuri og hypertension i graviditet, under fødsel og barselperiode [DO10-DO16]",DO10-DO16,"DO10, DO100, DO101, DO102, DO103, DO104, DO109, DO11, DO119, DO119A, DO119B, DO119C, DO12, DO120, DO121, DO122, DO13, DO139, DO14, DO140, DO141, DO142, DO149, DO15, DO150, DO151, DO152, DO159, DO16, DO169"
Andre sygdomme hos moder overvejende forbundet med graviditet [DO20-DO29],DO20-DO29,"DO20, DO200, DO208, DO208A, DO208B, DO208C, DO209, DO21, DO210, DO211, DO212, DO218, DO219, DO22, DO220, DO221, DO221A, DO221B, DO221C, DO222, DO223, DO224, DO225, DO225A, DO228, DO229, DO23, DO230, DO231, DO232, DO233, DO234, DO235, DO235A, DO239, DO24, DO240, DO240A, DO240B, DO240C, DO241, DO241A, DO241B, DO241C, DO242, DO242A, DO242B, DO242C, DO243, DO243A, DO243B, DO243C, DO244, DO244B, DO244C, DO244D, DO244E, DO245, DO249, DO249A, DO249B, DO249C, DO25, DO259, DO26, DO260, DO261, DO262, DO263, DO264, DO265, DO266, DO266A, DO266B, DO266C, DO266D, DO266F, DO266G, DO267, DO267A, DO267B, DO268, DO268A, DO268B, DO268C, DO268D, DO268E, DO268F, DO268G, DO268H, DO268J, DO269, DO28, DO280, DO281, DO282, DO283, DO283A, DO283A1, DO284, DO285, DO285A, DO285B, DO288, DO289, DO29, DO290, DO290A, DO290B, DO290C, DO291, DO291A, DO291B, DO292, DO292A, DO293, DO294, DO295, DO296, DO298, DO299"
"Tilstande med relation til foster, amnion, placenta og potentielle fødselsproblemer som årsag til graviditetskontrol [DO30-DO49]",DO30-DO49,"DO30, DO300, DO300C, DO300D, DO300E, DO301, DO302, DO308, DO308A, DO308A1, DO308A2, DO309, DO31, DO310, DO311, DO312, DO312C, DO312D, DO318, DO318C, DO32, DO320, DO321, DO322, DO322A, DO322B, DO323, DO323A, DO323B, DO324, DO325, DO326, DO328, DO329, DO33, DO330, DO331, DO332, DO333, DO334, DO335, DO336, DO337, DO337A, DO337B, DO337C, DO337D, DO337E, DO337F, DO338, DO339, DO339A, DO339B, DO34, DO340, DO340A, DO341, DO342, DO343, DO343A, DO343B, DO343C, DO344, DO344A, DO344B, DO344C, DO344D, DO344E, DO344F, DO345, DO345A, DO345B, DO345C, DO345D, DO346, DO346A, DO346B, DO346C, DO346D, DO346E, DO347, DO347A, DO347B, DO347C, DO347D, DO347E, DO347F, DO348, DO348A, DO348B, DO348C, DO348D, DO348G, DO349, DO35, DO350, DO350A, DO350B, DO351, DO352, DO353, DO353A, DO353B, DO354, DO355, DO355A, DO356, DO357, DO357A, DO357B, DO357C, DO357D, DO357E, DO357F, DO357G, DO358, DO358A, DO358B, DO359, DO359A, DO359B, DO359B1, DO359B2, DO36, DO360, DO361, DO361A, DO361B, DO362, DO362A, DO362B, DO362C, DO362D, DO363, DO364, DO365, DO365A, DO365B, DO365C, DO365D, DO366, DO367, DO368, DO368A, DO368B, DO368D, DO368E, DO368E1, DO368E2, DO368F, DO368G, DO368H, DO368K, DO368L, DO368M, DO368N, DO368P, DO368Q, DO368Q1, DO368Q2, DO368R, DO368S, DO368T, DO369, DO40, DO409, DO41, DO410, DO411, DO411A, DO411B, DO411C, DO411D, DO418, DO418A, DO418B, DO418C, DO419, DO42, DO420, DO422, DO423, DO424, DO429, DO43, DO430, DO430C, DO430D, DO430E, DO430F, DO430G, DO431, DO431A, DO431C, DO431E, DO431F, DO438, DO438A, DO438B, DO438C, DO438D, DO438E, DO438F, DO439, DO44, DO440, DO440A, DO440B, DO441, DO441A, DO441B, DO449, DO45, DO450, DO458, DO459, DO46, DO460, DO468, DO468A, DO469, DO47, DO470, DO471, DO472, DO479, DO48, DO489, DO49, DO499"
Fødselskomplikationer [DO60-DO75],DO60-DO75,"DO60, DO600, DO601, DO602, DO603, DO609, DO61, DO610, DO610A, DO610B, DO611, DO618, DO619, DO62, DO620, DO620A, DO620B, DO620C, DO620F, DO621, DO621A, DO622, DO622A, DO623, DO624, DO624A, DO624B, DO624C, DO624D, DO628, DO629, DO63, DO630, DO630A, DO631, DO632, DO632A, DO639, DO64, DO640, DO640A, DO640B, DO640C, DO640D, DO640E, DO640F, DO640G, DO640H, DO641, DO641A, DO642, DO643, DO644, DO645, DO648, DO649, DO65, DO650, DO651, DO652, DO653, DO654, DO655, DO656, DO658, DO659, DO66, DO660, DO661, DO662, DO663, DO663A, DO663B, DO663C, DO663D, DO663E, DO663F, DO663G, DO663H, DO663I, DO664, DO665, DO665A, DO665B, DO668, DO668A, DO669, DO67, DO670, DO670B, DO670C, DO670D, DO670E, DO678, DO678A, DO679, DO68, DO680, DO680A, DO680C, DO680D, DO680F, DO681, DO681A, DO682, DO683, DO688, DO688A, DO688B, DO689, DO69, DO690, DO691, DO692, DO692A, DO692B, DO693, DO694, DO694A, DO695, DO695A, DO695B, DO698, DO698A, DO699, DO70, DO700, DO700A, DO700B, DO700C, DO700D, DO701, DO701B, DO702, DO702D, DO702E, DO702G, DO703, DO704, DO709, DO71, DO710, DO710A, DO710B, DO711, DO711A, DO711AA, DO711AB, DO711B, DO712, DO713, DO714, DO715, DO715A, DO715B, DO715C, DO715D, DO716, DO716A, DO716B, DO716C, DO716D, DO717, DO718, DO719, DO72, DO720, DO721, DO722, DO73, DO730, DO730A, DO730A1, DO730A2, DO730A3, DO731, DO731A, DO731B, DO74, DO740, DO740A, DO741, DO741A, DO742, DO742A, DO742B, DO743, DO743A, DO744, DO745, DO745A, DO745B, DO746, DO747, DO748, DO748A, DO749, DO75, DO750, DO751, DO752, DO753, DO753A, DO754, DO754A, DO754B, DO754C, DO754D, DO754E, DO754F, DO755, DO756, DO756A, DO756B, DO757, DO758, DO758A, DO759"
Fødsel [DO80-DO84],DO80-DO84,"DO80, DO809, DO81, DO819, DO82, DO829, DO83, DO836, DO837, DO838, DO839, DO84, DO840, DO841, DO842, DO842A, DO846, DO847, DO848, DO849"
