Description,SKSCodes_range,SKSCodes
Infektiøse tarmsygdomme [DA00-DA09],DA00-DA09,"DA00, DA000, DA001, DA009, DA01, DA010, DA011, DA012, DA013, DA014, DA02, DA020, DA021, DA022, DA028, DA029, DA03, DA030, DA031, DA032, DA033, DA038, DA039, DA04, DA040, DA041, DA042, DA043, DA044, DA045, DA046, DA047, DA048, DA049, DA05, DA050, DA051, DA052, DA053, DA054, DA058, DA059, DA06, DA060, DA061, DA062, DA063, DA063A, DA064, DA065, DA066, DA067, DA068, DA068A, DA069, DA07, DA070, DA071, DA072, DA073, DA078, DA078A, DA078C, DA078D, DA079, DA08, DA080, DA081, DA082, DA083, DA083A, DA084, DA085, DA09, DA090, DA099"
Tuberkulose [DA15-DA19],DA15-DA19,"DA15, DA150, DA151, DA152, DA153, DA154, DA155, DA156, DA157, DA158, DA158A, DA158B, DA158C, DA159, DA16, DA160, DA161, DA162, DA162A, DA162B, DA162C, DA163, DA164, DA165, DA167, DA168, DA168A, DA168B, DA168C, DA169, DA17, DA170, DA171, DA178, DA179, DA18, DA180, DA181, DA182, DA183, DA183F, DA183G, DA183H, DA184, DA184A, DA184B, DA184C, DA184D, DA184F, DA184G, DA184H, DA184I, DA184J, DA185, DA186, DA187, DA187A, DA188, DA19, DA190, DA191, DA192, DA198, DA199"
Visse dyreoverførte bakterielle sygdomme [DA20-DA28],DA20-DA28,"DA20, DA200, DA201, DA202, DA203, DA207, DA208, DA209, DA21, DA210, DA211, DA212, DA213, DA217, DA218, DA219, DA22, DA220, DA221, DA222, DA227, DA228, DA229, DA23, DA230, DA231, DA232, DA233, DA238, DA239, DA24, DA240, DA241, DA242, DA243, DA244, DA25, DA250, DA250A, DA251, DA259, DA26, DA260, DA267, DA268, DA269, DA27, DA270, DA278, DA279, DA28, DA280, DA281, DA282, DA282B, DA288, DA289"
Andre bakterielle sygdomme [DA30-DA49],DA30-DA49,"DA30, DA300, DA301, DA302, DA303, DA304, DA305, DA308, DA309, DA31, DA310, DA310A, DA310B, DA310C, DA311, DA311A, DA311B, DA318, DA319, DA32, DA320, DA321, DA327, DA328, DA328A, DA329, DA33, DA339, DA34, DA349, DA35, DA359, DA36, DA360, DA360A, DA361, DA362, DA362A, DA363, DA368, DA369, DA37, DA370, DA371, DA378, DA379, DA38, DA389, DA39, DA390, DA391, DA392, DA392A, DA393, DA394, DA395, DA398, DA399, DA40, DA400, DA401, DA402, DA403, DA408, DA409, DA41, DA410, DA411, DA411A, DA412, DA413, DA414, DA415, DA415A, DA418, DA419, DA419B, DA419C, DA42, DA420, DA421, DA422, DA427, DA428, DA429, DA43, DA430, DA431, DA438, DA439, DA44, DA440, DA441, DA448, DA449, DA46, DA469, DA48, DA480, DA481, DA482, DA483, DA484, DA484A, DA488, DA488A, DA49, DA490, DA491, DA492, DA493, DA498, DA499, DA499A"
"Infektioner, som overvejende er seksuelt overført [DA50-DA64]",DA50-DA64,"DA50, DA500, DA501, DA502, DA503, DA504, DA505, DA505A, DA505B, DA505C, DA506, DA507, DA509, DA51, DA510, DA511, DA512, DA513, DA513A, DA513F, DA514, DA514A, DA515, DA519, DA52, DA520, DA521, DA521D, DA522, DA523, DA527, DA527A, DA527C, DA528, DA529, DA53, DA530, DA539, DA54, DA540, DA540A, DA540B, DA540D, DA540E, DA540F, DA541, DA541A, DA541B, DA542, DA543, DA543A, DA544, DA545, DA546, DA548, DA548B, DA548G, DA549, DA55, DA559, DA56, DA560, DA560A, DA560C, DA560D, DA560E, DA561, DA562, DA563, DA564, DA568, DA57, DA579, DA58, DA589, DA59, DA590, DA590A, DA590C, DA598, DA599, DA60, DA600, DA601, DA601A, DA601B, DA601C, DA609, DA63, DA630, DA630B, DA630C, DA630D, DA630E, DA638, DA638A, DA64, DA649"
Andre sygdomme forårsaget af spirokæter [DA65-DA69],DA65-DA69,"DA65, DA659, DA66, DA660, DA661, DA662, DA663, DA664, DA665, DA666, DA667, DA668, DA669, DA67, DA670, DA671, DA672, DA673, DA679, DA68, DA680, DA681, DA689, DA69, DA690, DA690A, DA690B, DA690C, DA691, DA691A, DA691B, DA691C, DA691E, DA691F, DA691G, DA692, DA692A, DA692D, DA692F, DA698, DA699"
Andre sygdomme forårsaget af Klamydia-bakterier [DA70-DA74],DA70-DA74,"DA70, DA709, DA71, DA710, DA711, DA719, DA74, DA740, DA748, DA749"
Rickettsia-infektioner [DA75-DA79],DA75-DA79,"DA75, DA750, DA751, DA752, DA753, DA759, DA77, DA770, DA771, DA772, DA773, DA778, DA779, DA78, DA789, DA79, DA790, DA791, DA798, DA798A, DA798B, DA799"
Virale infektioner i centralnervesystemet [DA80-DA89],DA80-DA89,"DA80, DA800, DA801, DA802, DA803, DA804, DA809, DA81, DA810, DA811, DA812, DA818, DA818A, DA818B, DA819, DA819A, DA82, DA820, DA821, DA829, DA83, DA830, DA831, DA832, DA833, DA834, DA835, DA836, DA838, DA839, DA84, DA840, DA841, DA848, DA849, DA85, DA850, DA851, DA852, DA858, DA858A, DA86, DA869, DA87, DA870, DA870A, DA870B, DA871, DA872, DA872A, DA878, DA879, DA88, DA880, DA881, DA888, DA89, DA899"
Virale febersygdomme overført af leddyr og virale hæmoragiske febersygdomme [DA92-DA99],DA92-DA99,"DA92, DA920, DA921, DA922, DA923, DA924, DA925, DA928, DA929, DA93, DA930, DA931, DA932, DA938, DA94, DA949, DA95, DA950, DA951, DA959, DA96, DA960, DA961, DA962, DA968, DA969, DA97, DA970, DA971, DA972, DA979, DA98, DA980, DA981, DA982, DA983, DA984, DA985, DA985A, DA985B, DA985C, DA988, DA99, DA999"
Virale infektioner karakteriseret ved hud- og slimhindeaffektioner [DB00-DB09],DB00-DB09,"DB00, DB000, DB001, DB001A, DB001B, DB001C, DB002, DB002A, DB002B, DB002C, DB003, DB004, DB004A, DB005, DB007, DB008, DB009, DB01, DB010, DB011, DB011A, DB012, DB018, DB019, DB02, DB020, DB020A, DB021, DB022, DB023, DB027, DB028, DB029, DB03, DB039, DB04, DB049, DB05, DB050, DB051, DB052, DB053, DB054, DB058, DB059, DB06, DB060, DB068, DB069, DB07, DB079, DB079A, DB079C, DB079D, DB08, DB080, DB080A, DB080B, DB081, DB082, DB083, DB084, DB085, DB088, DB088A, DB088B, DB09, DB099, DB099A"
Viral leverbetændelse [DB15-DB19],DB15-DB19,"DB15, DB150, DB159, DB159A, DB16, DB160, DB161, DB162, DB169, DB169A, DB17, DB170, DB171, DB172, DB178, DB179, DB18, DB180, DB181, DB182, DB188, DB189, DB19, DB190, DB199"
Human immundefekt virus (HIV) sygdom [DB20-DB24],DB20-DB24,"DB20, DB200, DB200A, DB201, DB202, DB203, DB204, DB205, DB206, DB207, DB208, DB209, DB22, DB220, DB220A, DB221, DB222, DB227, DB23, DB230, DB231, DB232, DB238, DB238A, DB24, DB249"
Andre virale sygdomme [DB25-DB34],DB25-DB34,"DB25, DB250, DB251, DB252, DB258, DB259, DB26, DB260, DB261, DB262, DB263, DB268, DB269, DB27, DB270, DB271, DB278, DB279, DB30, DB300, DB301, DB301A, DB301B, DB302, DB303, DB303A, DB303B, DB303C, DB308, DB308A, DB309, DB33, DB330, DB331, DB332, DB333, DB334, DB338, DB34, DB340, DB341, DB341A, DB341B, DB342, DB342A, DB343, DB344, DB348, DB349, DB349A"
Svampesygdomme [DB35-DB49],DB35-DB49,"DB35, DB350, DB350A, DB350B, DB350C, DB351, DB352, DB353, DB354, DB354A, DB355, DB356, DB356B, DB358, DB358A, DB358B, DB359, DB36, DB360, DB361, DB362, DB363, DB368, DB368A, DB369, DB37, DB370, DB370A, DB371, DB372, DB372A, DB372B, DB373, DB373A, DB373B, DB373C, DB374, DB375, DB376, DB377, DB378, DB378A, DB378B, DB378C, DB379, DB38, DB380, DB381, DB382, DB383, DB384, DB387, DB388, DB389, DB39, DB390, DB391, DB392, DB393, DB394, DB395, DB399, DB40, DB400, DB401, DB402, DB403, DB407, DB408, DB409, DB41, DB410, DB411, DB418, DB419, DB42, DB420, DB421, DB427, DB428, DB429, DB43, DB430, DB431, DB432, DB438, DB439, DB44, DB440, DB441, DB441A, DB441B, DB442, DB447, DB448, DB448A, DB448B, DB449, DB45, DB450, DB451, DB451B, DB452, DB453, DB457, DB458, DB459, DB46, DB460, DB461, DB462, DB463, DB463A, DB464, DB465, DB468, DB468A, DB469, DB469B, DB47, DB470, DB471, DB479, DB48, DB480, DB481, DB482, DB483, DB484, DB485, DB487, DB488, DB49, DB499, DB499A"
Protozosygdomme [DB50-DB64],DB50-DB64,"DB50, DB500, DB500A, DB508, DB509, DB51, DB510, DB518, DB519, DB52, DB520, DB528, DB529, DB53, DB530, DB531, DB538, DB538A, DB54, DB549, DB55, DB550, DB551, DB552, DB559, DB56, DB560, DB561, DB569, DB57, DB570, DB571, DB572, DB572A, DB573, DB574, DB575, DB579, DB58, DB580, DB581, DB582, DB583, DB588, DB589, DB60, DB600, DB600A, DB601, DB602, DB608, DB608A, DB64, DB649"
Ormesygdomme [DB65-DB83],DB65-DB83,"DB65, DB650, DB651, DB652, DB653, DB658, DB659, DB66, DB660, DB661, DB662, DB663, DB664, DB665, DB668, DB669, DB67, DB670, DB671, DB672, DB673, DB674, DB675, DB676, DB677, DB678, DB679, DB68, DB680, DB681, DB689, DB69, DB690, DB691, DB698, DB699, DB70, DB700, DB701, DB71, DB710, DB711, DB718, DB719, DB72, DB729, DB73, DB739, DB74, DB740, DB741, DB742, DB743, DB744, DB748, DB748B, DB749, DB75, DB759, DB76, DB760, DB761, DB768, DB769, DB769A, DB77, DB770, DB778, DB779, DB78, DB780, DB781, DB787, DB789, DB79, DB799, DB80, DB809, DB81, DB810, DB811, DB812, DB813, DB814, DB818, DB82, DB820, DB829, DB83, DB830, DB830A, DB831, DB832, DB833, DB834, DB838, DB839"
"Infestationer med lus, mider og andre ektoparasitter [DB85-DB89]",DB85-DB89,"DB85, DB850, DB851, DB852, DB853, DB854, DB86, DB869, DB869A, DB869B, DB87, DB870, DB871, DB872, DB873, DB874, DB878, DB879, DB88, DB880, DB881, DB882, DB883, DB888, DB888A, DB888B, DB888C, DB888D, DB889, DB89, DB899, DB899A"
Følgetilstande efter infektiøse og parasitære sygdomme [DB90-DB94],DB90-DB94,"DB90, DB900, DB901, DB902, DB908, DB909, DB91, DB919, DB92, DB929, DB94, DB940, DB941, DB942, DB948, DB948A, DB949"
"Bakterielle, virale og andre infektiøse agentia [DB95-DB98]",DB95-DB98,"DB95, DB950, DB951, DB952, DB953, DB954, DB955, DB956, DB956A, DB957, DB958, DB96, DB960, DB961, DB962, DB963, DB964, DB965, DB966, DB967, DB968, DB97, DB970, DB971, DB972, DB972A, DB972B, DB972B1, DB973, DB974, DB975, DB976, DB977, DB978, DB98, DB980, DB981"
Andre infektionssygdomme [DB99-DB99],DB99-DB99,"DB99, DB999"
"Kræft i læber, mundhule og svælg [DC00-DC14]",DC00-DC14,"DC00, DC000, DC001, DC002, DC003, DC004, DC005, DC006, DC008, DC009, DC01, DC019, DC02, DC020, DC021, DC021A, DC022, DC022A, DC023, DC024, DC028, DC029, DC03, DC030, DC031, DC039, DC04, DC040, DC041, DC048, DC049, DC05, DC050, DC051, DC052, DC058, DC059, DC06, DC060, DC061, DC062, DC068, DC069, DC07, DC079, DC08, DC080, DC081, DC088, DC089, DC09, DC090, DC091, DC091A, DC091B, DC092, DC098, DC099, DC10, DC100, DC101, DC102, DC103, DC104, DC104A, DC104B, DC108, DC109, DC11, DC110, DC111, DC112, DC113, DC118, DC119, DC12, DC129, DC13, DC130, DC131, DC132, DC138, DC139, DC14, DC140, DC141, DC142, DC148"
Kræft i fordøjelsesorganer [DC15-DC26],DC15-DC26,"DC15, DC153, DC154, DC155, DC158, DC159, DC16, DC160, DC161, DC162, DC163, DC164, DC165, DC166, DC168, DC169, DC17, DC170, DC171, DC172, DC173, DC178, DC179, DC18, DC180, DC180A, DC181, DC182, DC183, DC184, DC185, DC186, DC187, DC188, DC188A, DC189, DC20, DC209, DC21, DC210, DC211, DC212, DC218, DC22, DC220, DC221, DC221A, DC222, DC223, DC224, DC227, DC229, DC23, DC239, DC24, DC240, DC240A, DC240B, DC240C, DC240D, DC240E, DC241, DC248, DC249, DC25, DC250, DC251, DC252, DC253, DC254, DC257, DC258, DC259, DC26, DC260, DC261, DC268, DC269"
Kræft i åndedrætsorganer og organer i brysthulen [DC30-DC39],DC30-DC39,"DC30, DC300, DC300A, DC300B, DC300C, DC301, DC301A, DC301B, DC31, DC310, DC311, DC312, DC313, DC318, DC319, DC32, DC320, DC320A, DC321, DC321A, DC321B, DC321C, DC321D, DC322, DC323, DC328, DC329, DC33, DC339, DC34, DC340, DC340A, DC340B, DC341, DC342, DC343, DC348, DC349, DC37, DC379, DC38, DC380, DC380A, DC381, DC382, DC383, DC384, DC388, DC39, DC390, DC398, DC399"
Kræft i knogler og ledbrusk [DC40-DC41],DC40-DC41,"DC40, DC400, DC400A, DC400B, DC400C, DC400D, DC401, DC401A, DC401B, DC402, DC402A, DC402B, DC403, DC403A, DC403B, DC408, DC409, DC41, DC410, DC410A, DC410B, DC410C, DC410D, DC410E, DC410F, DC410G, DC411, DC411A, DC412, DC412A, DC412B, DC413, DC413A, DC413B, DC413C, DC413D, DC413E, DC413F, DC414, DC414A, DC414B, DC414C, DC414D, DC414E, DC414F, DC418, DC419, DC419A, DC419B"
Modermærkekræft i hud og anden hudkræft [DC43-DC44],DC43-DC44,"DC43, DC430, DC431, DC431A, DC431B, DC432, DC432A, DC432B, DC433, DC434, DC434A, DC434B, DC435, DC435A, DC435B, DC435C, DC435L, DC436, DC436A, DC436B, DC436C, DC437, DC437A, DC437B, DC437C, DC438, DC439, DC44, DC440, DC441, DC441A, DC442, DC442A, DC442B, DC443, DC444, DC444A, DC444B, DC445, DC445A, DC445B, DC445C, DC446, DC446A, DC446B, DC446C, DC447, DC447A, DC447B, DC447C, DC448, DC449"
"Kræft i mesotel, bindevæv og andet bløddelsvæv [DC45-DC49]",DC45-DC49,"DC45, DC450, DC451, DC452, DC457, DC459, DC46, DC460, DC461, DC462, DC463, DC467, DC468, DC469, DC47, DC470, DC470A, DC470B, DC470C, DC470D, DC470E, DC470F, DC471, DC471A, DC471B, DC471C, DC471D, DC472, DC472A, DC472B, DC472C, DC472D, DC473, DC473A, DC473B, DC474, DC474A, DC474B, DC475, DC475A, DC475B, DC476, DC476A, DC476B, DC478, DC478A, DC478B, DC479, DC479A, DC479B, DC48, DC480, DC481, DC481A, DC481B, DC481C, DC482, DC488, DC49, DC490, DC490A, DC490B, DC490C, DC491, DC491A, DC491B, DC492, DC492A, DC492B, DC493, DC493A, DC493B, DC494, DC495, DC495A, DC496, DC498, DC499"
Brystkræft [DC50-DC50],DC50-DC50,"DC50, DC500, DC500A, DC500B, DC501, DC502, DC503, DC504, DC505, DC506, DC508, DC509"
Kræft i kvindelige kønsorganer [DC51-DC58],DC51-DC58,"DC51, DC510, DC510A, DC511, DC512, DC518, DC519, DC52, DC529, DC53, DC539, DC54, DC549, DC55, DC559, DC56, DC569, DC569A, DC57, DC570, DC571, DC572, DC573, DC574, DC577, DC578, DC579, DC58, DC589, DC589A, DC589B"
Kræft i mandlige kønsorganer [DC60-DC63],DC60-DC63,"DC60, DC600, DC601, DC602, DC608, DC609, DC61, DC619, DC619Y, DC619Z, DC62, DC620, DC621, DC629, DC629A, DC63, DC630, DC631, DC632, DC637, DC638, DC639"
Kræft i nyre og urinveje [DC64-DC68],DC64-DC68,"DC64, DC649, DC65, DC659, DC66, DC669, DC67, DC677, DC679, DC68, DC680, DC681, DC688, DC689"
"Kræft i øje, hjerne og andre dele af centralnervesystem [DC69-DC72]",DC69-DC72,"DC69, DC690, DC691, DC692, DC692A, DC693, DC694, DC695, DC695A, DC695B, DC696, DC698, DC699, DC699A, DC70, DC700, DC701, DC709, DC71, DC710, DC710A, DC710B, DC711, DC712, DC713, DC714, DC715, DC716, DC717, DC717A, DC717B, DC717C, DC718, DC719, DC72, DC720, DC721, DC722, DC722A, DC723, DC724, DC725, DC728, DC729"
Kræft i skjoldbruskkirtel og andre endokrine kirtler [DC73-DC75],DC73-DC75,"DC73, DC739, DC74, DC740, DC741, DC749, DC75, DC750, DC751, DC752, DC753, DC754, DC755, DC755A, DC755B, DC758, DC759"
"Kræft med dårligt specificerede, sekundære og ikke specificerede lokalisationer [DC76-DC80]",DC76-DC80,"DC76, DC760, DC760A, DC760B, DC760C, DC761, DC762, DC763, DC764, DC765, DC767, DC768, DC77, DC770, DC770A, DC770A1, DC770A2, DC770B, DC770C, DC770C1, DC770C2, DC770D, DC770E, DC770E1, DC770E2, DC770F, DC770G, DC770G1, DC770G2, DC770H, DC771, DC771A, DC771A1, DC771A2, DC771B, DC772, DC772A, DC772A1, DC772A2, DC772B, DC773, DC773A, DC773A1, DC773A2, DC773B, DC773C, DC773C1, DC773C2, DC773D, DC773E, DC773E1, DC773E2, DC773F, DC774, DC774A, DC774A1, DC774A2, DC774B, DC774C, DC774C1, DC774C2, DC774D, DC775, DC775A, DC775A1, DC775A2, DC775B, DC778, DC778A, DC778A1, DC778A2, DC778B, DC779, DC779A, DC779A1, DC779A2, DC779B, DC78, DC780, DC781, DC782, DC782A, DC782B, DC783, DC784, DC784A, DC785, DC785A, DC785B, DC786, DC786A, DC786B, DC786C, DC786D, DC786E, DC787, DC788, DC79, DC790, DC790A, DC790B, DC791, DC791I, DC791J, DC791S, DC791T, DC791U, DC791V, DC792, DC793, DC793A, DC793B, DC793C, DC794, DC795, DC795A, DC795B, DC795C, DC795D, DC795E, DC796, DC797, DC798, DC798A, DC798C, DC798D, DC798E, DC798F, DC798Z, DC799, DC80, DC800, DC809, DC809A"
Kræft i lymfatisk og bloddannende væv [DC81-DC96],DC81-DC96,"DC81, DC810, DC811, DC812, DC813, DC814, DC817, DC819, DC82, DC820, DC821, DC822, DC825, DC826, DC827, DC829, DC83, DC830, DC830B, DC830C, DC830D, DC831, DC831A, DC831B, DC833, DC833A, DC833B, DC833C, DC833D, DC833E, DC833F, DC835, DC835A, DC835B, DC835C, DC837, DC837A, DC837B, DC838, DC838A, DC838B, DC839, DC84, DC840, DC840A, DC840B, DC840C, DC841, DC844, DC844F, DC844H, DC845, DC846, DC846A, DC847, DC848, DC849, DC85, DC851, DC852, DC857, DC857B, DC859, DC86, DC860, DC861, DC862, DC863, DC864, DC865, DC866, DC866B, DC866C, DC88, DC880, DC882, DC882A, DC882B, DC883, DC883A, DC883B, DC884, DC884A, DC884B, DC884C, DC887, DC889, DC90, DC900, DC901, DC902, DC903, DC91, DC910, DC911, DC911A, DC911B, DC913, DC914, DC915, DC915A, DC915B, DC915C, DC915D, DC916, DC917, DC917B, DC918, DC919, DC92, DC920, DC920A, DC920B, DC920C, DC920D, DC920E, DC920F, DC920G, DC920H, DC921, DC921A, DC922, DC923, DC923A, DC923B, DC924, DC924A, DC925, DC925A, DC926, DC926A, DC927, DC927B, DC928, DC929, DC93, DC930, DC930A, DC930B, DC931, DC931A, DC931B, DC931C, DC933, DC937, DC939, DC94, DC940, DC940A, DC942, DC943, DC944, DC946, DC947, DC947B, DC947C, DC95, DC950, DC950C, DC950D, DC951, DC957, DC959, DC96, DC960, DC960A, DC962, DC962B, DC964, DC964A, DC964B, DC964C, DC965, DC965A, DC965B, DC966, DC966A, DC966B, DC966C, DC966D, DC967, DC967A, DC968, DC969"
Lokalrecidiv [DC99-DC99],DC99-DC99,"DC99, DC991, DC991A, DC991B, DC991C, DC991D, DC991E, DC991Y"
Carcinoma in situ [DD00-DD09],DD00-DD09,"DD00, DD000, DD000A, DD000B, DD000C, DD001, DD002, DD01, DD010, DD012, DD013, DD013A, DD013B, DD014, DD014A, DD015, DD015A, DD015B, DD015C, DD015D, DD017, DD017A, DD019, DD02, DD020, DD021, DD022, DD022A, DD022B, DD023, DD023A, DD023B, DD023C, DD024, DD03, DD030, DD031, DD031A, DD032, DD032A, DD032B, DD033, DD033A, DD034, DD034A, DD034B, DD035, DD035A, DD035B, DD035C, DD035G, DD036, DD036A, DD036B, DD037, DD037A, DD037B, DD038, DD039, DD04, DD040, DD041, DD041A, DD042, DD042A, DD042B, DD043, DD043A, DD043B, DD043C, DD044, DD044A, DD044B, DD045, DD045A, DD045B, DD045C, DD046, DD046A, DD046B, DD047, DD047A, DD047B, DD048, DD049, DD05, DD050, DD051, DD056, DD057, DD059, DD06, DD069, DD07, DD070, DD071, DD071A, DD072, DD072A, DD073, DD073A, DD073B, DD073B1, DD073C, DD074, DD075, DD076, DD076A, DD076B, DD076T, DD09, DD090, DD091, DD091A, DD091B, DD091C, DD091D, DD092, DD093, DD093A, DD093B, DD095, DD096, DD096B, DD096C, DD096D, DD097, DD097A, DD099"
Godartede neoplasmer [DD10-DD36],DD10-DD36,"DD10, DD100, DD101, DD101A, DD102, DD103, DD103A, DD103B, DD104, DD104A, DD105, DD106, DD106A, DD107, DD109, DD11, DD110, DD117, DD117A, DD117B, DD119, DD12, DD120, DD120A, DD121, DD122, DD123, DD123A, DD123B, DD124, DD125, DD126, DD126A, DD126B, DD126C, DD126F, DD128, DD129, DD129A, DD129B, DD13, DD130, DD131, DD132, DD133, DD134, DD134A, DD135, DD136, DD137, DD137A, DD137B, DD139, DD139A, DD14, DD140, DD140A, DD140B, DD140C, DD140D, DD141, DD142, DD143, DD143A, DD143B, DD144, DD15, DD150, DD151, DD152, DD157, DD159, DD16, DD160, DD160C, DD160D, DD161, DD162, DD163, DD163C, DD164, DD164C, DD164D, DD164E, DD165, DD166, DD167, DD167D, DD167E, DD167F, DD168, DD168D, DD168E, DD168F, DD169, DD17, DD170, DD170A, DD170B, DD170C, DD170D, DD170E, DD170F, DD171, DD171C, DD172, DD173, DD174, DD175, DD176, DD177, DD177A, DD177B, DD177C, DD179, DD18, DD180, DD180A, DD180B, DD180C, DD180D, DD180E, DD180F, DD181, DD181A, DD181B, DD189, DD19, DD190, DD191, DD197, DD199, DD20, DD200, DD201, DD21, DD210, DD210A, DD210B, DD210C, DD211, DD211A, DD212, DD212B, DD213, DD214, DD215, DD216, DD216A, DD217, DD219, DD22, DD220, DD221, DD222, DD222A, DD222B, DD223, DD224, DD224A, DD224B, DD225, DD225A, DD225B, DD225C, DD226, DD226A, DD227, DD227A, DD228, DD229, DD229Q, DD23, DD230, DD231, DD231A, DD232, DD232A, DD232B, DD233, DD234, DD234A, DD234B, DD235, DD235A, DD235B, DD235C, DD236, DD236A, DD237, DD237A, DD239, DD24, DD249, DD249A, DD249C, DD249D, DD249E, DD249F, DD249G, DD249W, DD25, DD250, DD250A, DD250B, DD250C, DD251, DD252, DD259, DD26, DD260, DD261, DD267, DD269, DD27, DD270, DD271, DD272, DD278, DD279, DD28, DD280, DD281, DD282, DD282A, DD282B, DD282C, DD287, DD289, DD29, DD290, DD291, DD292, DD293, DD294, DD297, DD297A, DD297B, DD297C, DD299, DD30, DD300, DD301, DD302, DD303, DD304, DD307, DD309, DD31, DD310, DD311, DD312, DD313, DD314, DD315, DD315A, DD315B, DD315C, DD316, DD316A, DD319, DD32, DD320, DD321, DD329, DD33, DD330, DD330A, DD330B, DD330C, DD330D, DD331, DD331A, DD331B, DD331C, DD331D, DD332, DD333, DD333A, DD333B, DD334, DD337, DD339, DD34, DD349, DD35, DD350, DD350A, DD351, DD352, DD352A, DD353, DD354, DD355, DD356, DD356A, DD356B, DD356C, DD357, DD358, DD359, DD36, DD360, DD361, DD361A, DD361B, DD367, DD367A, DD369"
Tumorer af usikker eller ukendt karakter [DD37-DD48],DD37-DD48,"DD37, DD370, DD370A, DD370B, DD370C, DD371, DD372, DD373, DD374, DD375, DD376, DD376A, DD376B, DD376C, DD377, DD377A, DD377B, DD377C, DD379, DD38, DD380, DD381, DD381A, DD381B, DD381C, DD382, DD383, DD384, DD385, DD385A, DD385B, DD385C, DD385D, DD389, DD39, DD390, DD391, DD391A, DD392, DD392A, DD392B, DD397, DD397A, DD399, DD40, DD400, DD401, DD407, DD407A, DD409, DD41, DD410, DD411, DD412, DD413, DD414, DD417, DD419, DD42, DD420, DD421, DD429, DD43, DD430, DD430B, DD430C, DD430D, DD430E, DD430F, DD431, DD431G, DD431H, DD431J, DD432, DD433, DD434, DD437, DD439, DD44, DD440, DD441, DD442, DD443, DD444, DD445, DD446, DD447, DD447A, DD447B, DD448, DD448A, DD449, DD45, DD459, DD46, DD460, DD460A, DD460B, DD460C, DD461, DD462, DD462A, DD462B, DD464, DD465, DD466, DD467, DD469, DD47, DD470, DD470A, DD470B, DD470C, DD471, DD471B, DD472, DD472A, DD472B, DD473, DD474, DD474A, DD474B, DD474C, DD475, DD477, DD477A, DD477C, DD477D, DD479, DD479A, DD479B, DD48, DD480, DD481, DD482, DD482A, DD482B, DD482C, DD482D, DD482E, DD483, DD484, DD485, DD485A, DD485B, DD485C, DD485D, DD486, DD486A, DD487, DD487A, DD487B, DD487C, DD487D, DD489"
Ernæringsbetingede anæmier [DD50-DD53],DD50-DD53,"DD50, DD500, DD501, DD501A, DD508, DD508A, DD509, DD509A, DD51, DD510, DD511, DD511A, DD512, DD513, DD513A, DD518, DD519, DD52, DD520, DD521, DD528, DD529, DD53, DD530, DD531, DD531A, DD532, DD538, DD538A, DD538B, DD538C, DD538M, DD539"
Hæmolytiske anæmier [DD55-DD59],DD55-DD59,"DD55, DD550, DD551, DD552, DD553, DD558, DD559, DD56, DD560, DD561, DD561A, DD561C, DD562, DD563, DD564, DD568, DD569, DD57, DD570, DD571, DD572, DD572A, DD572B, DD572C, DD572D, DD573, DD578, DD58, DD580, DD581, DD581A, DD582, DD582A, DD582B, DD582C, DD582D, DD582E, DD588, DD588A, DD589, DD59, DD590, DD591, DD591A, DD592, DD593, DD594, DD594A, DD594B, DD594C, DD595, DD596, DD596A, DD596B, DD598, DD599, DD599A"
Aplastiske og andre anæmier [DD60-DD64],DD60-DD64,"DD60, DD600, DD601, DD608, DD609, DD61, DD610, DD610A, DD610B, DD610C, DD610D, DD610E, DD611, DD612, DD613, DD618, DD619, DD619A, DD619B, DD619C, DD619D, DD62, DD629, DD63, DD630, DD638, DD64, DD640, DD640A, DD641, DD642, DD643, DD643A, DD644, DD648, DD648A, DD648B, DD649"
"Koagulationsdefekter, purpura og andre hæmoragiske tilstande [DD65-DD69]",DD65-DD69,"DD65, DD659, DD659A, DD659B, DD659C, DD659D, DD66, DD669, DD669B, DD669C, DD669D, DD669E, DD67, DD679, DD679A, DD679B, DD679C, DD679D, DD68, DD680, DD680A, DD680B, DD680B1, DD680B2, DD680B3, DD680B4, DD680C, DD681, DD682, DD682A, DD683, DD683A, DD684, DD684A, DD684B, DD684C, DD685, DD685A, DD685B, DD685E, DD685F, DD685K, DD685L, DD685M, DD686, DD686E, DD686F, DD686G, DD688, DD689, DD69, DD690, DD690A, DD690B, DD690C, DD690D, DD690E, DD690F, DD691, DD691A, DD691B, DD691C, DD692, DD692B, DD692C, DD692D, DD692E, DD692F, DD692H, DD693, DD694, DD694A, DD695, DD696, DD698, DD698A, DD698B, DD699"
Andre sygdomme i blod og bloddannende organer [DD70-DD77],DD70-DD77,"DD70, DD709, DD709A, DD709B, DD709C, DD709D, DD709E, DD71, DD719, DD719A, DD719B, DD719C, DD719D, DD72, DD720, DD720A, DD720B, DD720C, DD720D, DD720E, DD720F, DD721, DD721A, DD721B, DD728, DD728A, DD728B, DD728C, DD728D, DD728E, DD728F, DD728G, DD728H, DD729, DD73, DD730, DD730A, DD730B, DD731, DD732, DD733, DD734, DD735, DD735A, DD735B, DD738, DD738A, DD738C, DD738D, DD739, DD74, DD740, DD740A, DD740B, DD748, DD748A, DD748B, DD748C, DD749, DD75, DD750, DD751, DD751C, DD751D, DD751E, DD751F, DD751G, DD751H, DD758, DD758C, DD758D, DD759, DD76, DD761, DD761A, DD762, DD763, DD763A, DD763B, DD763D, DD77, DD779, DD779A"
Visse forstyrrelser i immunsystem [DD80-DD89],DD80-DD89,"DD80, DD800, DD800A, DD800B, DD801, DD801A, DD801B, DD801C, DD802, DD803, DD804, DD805, DD806, DD807, DD808, DD808A, DD809, DD81, DD810, DD811, DD812, DD813, DD814, DD815, DD816, DD817, DD818, DD819, DD819A, DD82, DD820, DD821, DD822, DD823, DD823A, DD824, DD828, DD829, DD83, DD830, DD831, DD832, DD838, DD839, DD84, DD840, DD841, DD841A, DD841B, DD848, DD849, DD86, DD860, DD861, DD862, DD863, DD863A, DD868, DD868A, DD868G, DD869, DD89, DD890, DD890A, DD890B, DD891, DD892, DD898, DD899"
Sygdomme i skjoldbruskkirtlen [DE00-DE07],DE00-DE07,"DE00, DE000, DE001, DE002, DE009, DE01, DE010, DE011, DE012, DE018, DE02, DE029, DE03, DE030, DE030A, DE031, DE031A, DE031B, DE031C, DE032, DE033, DE034, DE035, DE038, DE039, DE04, DE040, DE041, DE042, DE042A, DE048, DE048A, DE049, DE05, DE050, DE051, DE052, DE052A, DE053, DE054, DE055, DE058, DE058A, DE058B, DE058C, DE059, DE059A, DE06, DE060, DE060A, DE060B, DE061, DE061C, DE062, DE063, DE063A, DE063B, DE064, DE065, DE065A, DE065B, DE065C, DE065D, DE069, DE07, DE070, DE070A, DE071, DE071A, DE071B, DE078, DE078B, DE078C, DE078D, DE078E, DE079"
Sukkersyge [DE10-DE14],DE10-DE14,"DE10, DE100, DE101, DE102, DE103, DE104, DE105, DE105A, DE105B, DE105C, DE105D, DE106, DE107, DE108, DE109, DE109A, DE11, DE110, DE111, DE112, DE113, DE114, DE115, DE115A, DE115B, DE115C, DE115D, DE116, DE117, DE118, DE119, DE119A, DE12, DE120, DE121, DE122, DE123, DE124, DE125, DE125A, DE125B, DE125C, DE125D, DE126, DE127, DE128, DE129, DE13, DE130, DE131, DE132, DE133, DE134, DE135, DE135A, DE135B, DE135C, DE135D, DE136, DE137, DE138, DE139, DE14, DE140, DE141, DE142, DE143, DE144, DE145, DE145A, DE145B, DE145C, DE145D, DE146, DE147, DE148, DE149"
Andre sygdomme i sukkerregulation og bugspytkirtlens indre sekretion [DE15-DE16],DE15-DE16,"DE15, DE159, DE159B, DE16, DE160, DE161, DE161A, DE161B, DE161C, DE161D, DE162, DE163, DE163A, DE164, DE164A, DE164B, DE168, DE168B, DE168C, DE168D, DE168F, DE169, DE169A"
